ticker,headline,summary,link,scraped_at,date,Date,Close,daily_return,volatility,text_for_sentiment,sentiment_score
GOOGL,"Alphabet Inc. (GOOGL): I Was “Small Minded” For Selling, Says Jim Cramer",,https://news.google.com/read/CBMigwFBVV95cUxOWnI4VWpNMnA5UWZNWkxjOTUwRUtwazNHMEtNU3pJQ1VnVVRGY0FMMURQUU1MclZOLTZjRDRuOWJaZjZvb2k5T05acWh3SDVsT2VtMVdCUjdnWS1hNGIyTlh6QmZJWkd4SHktd1JGRm8tZVlNTXhNMDFFU0ZmU0NhZHFGZw?hl=en-PK&gl=PK&ceid=PK%3Aen,2025-07-24 00:00:00.000000,2025-07-24,2025-07-24,192.1699981689453,0.010198194212151845,0.009968109188913166,"Alphabet Inc. (GOOGL): I Was “Small Minded” For Selling, Says Jim Cramer. ",0.0
GOOGL,Alphabet stock still looking cheap: Opening Bid top takeaway,,https://news.google.com/read/CBMiqAFBVV95cUxPVndaZVQzbGZVc2JZa0FIZ1VLbThsSzRDbkR2U0Q2dUdmeTlUTW1UcXptWG1iSDR5bHNyXzBXRUxDVkZWb1MwaEE0M1lReWl5ZjVZT1FUbDdBdEoyWm1jdGwyTmVuVzNBX2g1cGE4TFl3M3NNbHYxZDFCaUdySDNhMVdNUTM0bFZLQmlKdXRDTUlTZl9DMGJVcXNmMDJKSWlyTUNfS08tQXg?hl=en-PK&gl=PK&ceid=PK%3Aen,2025-07-24 00:00:00.000000,2025-07-24,2025-07-24,192.1699981689453,0.010198194212151845,0.009968109188913166,Alphabet stock still looking cheap: Opening Bid top takeaway. ,0.6792249083518982
GOOGL,"Alphabet Shares Jump 20% on Robust Search and Cloud Profits, Boosting Tech Stocks (NASDAQ:GOOGL)",,https://news.google.com/read/CBMi9wFBVV95cUxNN2dmbldKQlBKZTBnZV9uNzMtSzZjTDN1TnhhUVZvei1xSHZEWk5Ca3JUdVBaQTQ1Z01ieGo5VGt5WFJvbE1BN2lWSGM4Q05YOEtwV0JDRVdMNmtvSEVDRXItMHpYV0FLbXlpbkhBaUR3S2V0UkhycENETUNscm5PalVlYVJyWTAyQUVXd041UXZfZW83T0Q1NGg4XzFPSjVBNXdoM0JobXRkdEFVVVB1N09sbHJWS1ktNE5fV3VxNU1pUHJ2a0loNXE0cVBtNWxOYmItUzE3QlhwRU1lN1VnQWZtdzYxSVlKa2c1elhTYjhlaG9wRXU4?hl=en-PK&gl=PK&ceid=PK%3Aen,2025-07-24 00:00:00.000000,2025-07-24,2025-07-24,192.1699981689453,0.010198194212151845,0.009968109188913166,"Alphabet Shares Jump 20% on Robust Search and Cloud Profits, Boosting Tech Stocks (NASDAQ:GOOGL). ",0.9441019296646118
GOOGL,"Alphabet (GOOGL) Stock Climbs on Q2 Double-Beat, Unveil Record AI Budget",,https://news.google.com/read/CBMiggFBVV95cUxNU0NrOUNkb1dYRDhueWtyczJUNEQwQ2d2RVI3TF9wZXliZUZGeGFma2cyWEFhYXZzUVFlNmFmVkFNZU1DZ0k4bUtnRGhBTF85Y29XeHNNdmZiODZULVhaakY5S1BuLUJBUVdYdThRVmVpbC1XRVpLcUNJa0ZvX0hxc3dn?hl=en-PK&gl=PK&ceid=PK%3Aen,2025-07-24 00:00:00.000000,2025-07-24,2025-07-24,192.1699981689453,0.010198194212151845,0.009968109188913166,"Alphabet (GOOGL) Stock Climbs on Q2 Double-Beat, Unveil Record AI Budget. ",0.917402446269989
AAPL,Apple (AAPL) Earnings Expected to Grow: Should You Buy?,,https://news.google.com/read/CBMihgFBVV95cUxNRmxIVFRhNTBFNi03QW9oRTdCci1Vd1c1ekNUUi1DN2pzbXpVcEwwWnk2WTdBMWNRbjBUeVl4T1g2X2o2VVdGeDh4X1Z5cHlUOFBmdF9oQ2lQVU9sZVJzODI3YWtld2ZwSkx1TmRzZnlDbFdoLVBwV1B3MkRkclIxa21MaWxtUQ?hl=en-PK&gl=PK&ceid=PK%3Aen,2025-07-24 00:00:00.000000,2025-07-24,2025-07-24,213.51766967773438,-0.0018211487803653226,0.004295743044454463,Apple (AAPL) Earnings Expected to Grow: Should You Buy?. ,0.0
GOOGL,Google stock climbs following Q2 earnings beat,,https://news.google.com/read/CBMilwFBVV95cUxQXzZXa04wd04weEp0UUFOVlVEcnFmSjM0MHp4SHhnaVZmVkRLWW92ZHdVaC1HWmt0Wm9TdGQ5Z1JGSHJjTmdjdlhiUkpVdFQ2M20wSmhKcllhYlNPUzBsMWVDaFVkVjFTVVN5U3VjTXFQbW5MMF9ENGhjTC1GNjVoTzlJUWVtdmhJQjc3TVJsMTJPaFNpQ1Y0?hl=en-PK&gl=PK&ceid=PK%3Aen,2025-07-24 00:00:00.000000,2025-07-24,2025-07-24,192.1699981689453,0.010198194212151845,0.009968109188913166,Google stock climbs following Q2 earnings beat. ,0.6437315344810486
GOOGL,Stock market today: S&P 500 notches 4th consecutive record as Google earnings fuel AI hopes,,https://news.google.com/read/CBMi1wFBVV95cUxNTW5xVl9LWEs4Mk9WRElkZGVETTc2Q2daSW1acjBjSVN0c1FlQS1WSUczdjU5MWxQVENCQlktd3ZONWpsVERuVjhGMGhrTzNkUllFRlU0eVFHUjctVE0xbEs2VVpweG1oZWdlVlZtY1pxWEpvTVZWdWtCdmFZcEdSMXkzcEZwdVlWdlNKaUdFS042MDFKOUFMOVE3d21mZ2t6M1V1YWFJZnRUa1NFQk0zQUo4VEVZYkpXWko1Tm5ua0NzTGZRckJvX0Z3QXpHQ1BSQkRNMGxESQ?hl=en-PK&gl=PK&ceid=PK%3Aen,2025-07-24 00:00:00.000000,2025-07-24,2025-07-24,192.1699981689453,0.010198194212151845,0.009968109188913166,Stock market today: S&P 500 notches 4th consecutive record as Google earnings fuel AI hopes. ,0.7122783064842224
GOOGL,"Alphabet (GOOGL) Stock Is Up, What You Need To Know",,https://news.google.com/read/CBMie0FVX3lxTE1fSjRZd2ZaUkFyUUs3NEdZNlg5Q3N2aUwzY2ZPc2dEN2RDSTl2dGttckkwMENiczVLU1cwSEFfZnVWZjRLZGlGaHphbUdXNG42OWNTVmM4b2cwSlRmZ2VyTGFjTWFWWEtUMC1tYjVJQjAyQ0lEYnBHSDRfOA?hl=en-PK&gl=PK&ceid=PK%3Aen,2025-07-24 00:00:00.000000,2025-07-24,2025-07-24,192.1699981689453,0.010198194212151845,0.009968109188913166,"Alphabet (GOOGL) Stock Is Up, What You Need To Know. ",0.0
MSFT,Analyst Explains Why He’s Bullish on Microsoft (MSFT) Amid ‘AI Eating Software’ Trend,,https://news.google.com/read/CBMijAFBVV95cUxPblIyU25XUUZDSmZGRVJ4ZEl2N0hpRnBjOW9waTJwS3IwRGxqTFpHaDFBVnNUSmQwenVUSEtYeFJqUkN3WlZoaDlveF8xSElfWXBaeGRnTG9fYVNsSVQ1RE9XekNuei1OSXRCYnYxNTNHQnU5T3QyYWFwU28zYUtpN0tXY3VfLW1YSHk3cA?hl=en-PK&gl=PK&ceid=PK%3Aen,2025-07-24 00:00:00.000000,2025-07-24,2025-07-24,510.0415344238281,0.009903715255829226,0.0073958724518257465,Analyst Explains Why He’s Bullish on Microsoft (MSFT) Amid ‘AI Eating Software’ Trend. ,-0.639329731464386
MSFT,"AI-powered success—with more than 1,000 stories of customer transformation and innovation",,https://news.google.com/read/CBMi2wFBVV95cUxNME5hYTFnaE4wRmttRHFhVEw3ZW96NHV2UzR6bDkwdGpsNkJuMi1Tb2dkQTlNaG5yWHpndDBudVB3Rktscms2UmZnOEtJeHlFSXFGUTEyUm51aERaT0UxWmJ5cDdzNERQMkNIaFpwYXkzb0ZpZFFHY0hBMzlJNVVpeVE3Q216dFFVcUQwM1ZfLTkzcG1uandVYVRkcjR6NjdWMlZYZjE3Yl8zcUIwT2JxeGpfWjF2aGdLTG1rWDRlTDI1d1E1bThfTjlIMHVTTFJ5X1dKck1wR1FnVkU?hl=en-PK&gl=PK&ceid=PK%3Aen,2025-07-24 00:00:00.000000,2025-07-24,2025-07-24,510.0415344238281,0.009903715255829226,0.0073958724518257465,"AI-powered success—with more than 1,000 stories of customer transformation and innovation. ",0.0
MSFT,Microsoft (MSFT) Price Target Raised on Azure Optimism,,https://news.google.com/read/CBMihwFBVV95cUxQeXEwSm4xQ1F5WGF5S1RDYVZsN2lPMzVjXzFUY2EyeGkzcGNYYWotX1JydEFZZU5hVEY3dWJSN3VXc3Brd3ZpcGRsQXVoblhmRDlUZnVFS0t3cGFQUDV3Uk04SjVyeFN2Y1ZsS2QybmtBUlJ6ZThjZmFTa2h1akd0M2tDLWVtems?hl=en-PK&gl=PK&ceid=PK%3Aen,2025-07-24 00:00:00.000000,2025-07-24,2025-07-24,510.0415344238281,0.009903715255829226,0.0073958724518257465,Microsoft (MSFT) Price Target Raised on Azure Optimism. ,0.9092009663581848
AAPL,"Apple (AAPL) Isn’t Going To Buy Perplexity, Says Jim Cramer",,https://news.google.com/read/CBMid0FVX3lxTE9WVEktXzVlWGR0TnlTRDJZWndOck5Zei03bUFKSWhMUE9BLXRmc1EzYVFRakZGN2N2LXB6bmM0X3hlY0dnVWQ5RGd6MmhDVlhVVHpQVzVubi1LbHpaNjhlZ1FOdnd6RGNZaEpPV1B5M3FscThfRG5r?hl=en-PK&gl=PK&ceid=PK%3Aen,2025-07-24 00:00:00.000000,2025-07-24,2025-07-24,213.51766967773438,-0.0018211487803653226,0.004295743044454463,"Apple (AAPL) Isn’t Going To Buy Perplexity, Says Jim Cramer. ",0.0
GOOGL,How To Earn $500 A Month From Alphabet Stock Ahead Of Q2 Earnings,,https://news.google.com/read/CBMigAFBVV95cUxNTlRDNndBZUJLQ1Z4MDdsYnRENldRY3JuYnFseWRIRHlkMEJ3cWFGUUxzQ0JhbmpRS09VN3B1SmQzWnF5VHJCUGF2eW04RWRDUEFKaXlzUTNjankxMDVIekNNeGRIdElidC04ekJQRE9UcEU1QzNIMnlCdFU5Q0JobA?hl=en-PK&gl=PK&ceid=PK%3Aen,2025-07-23 00:00:00.000000,2025-07-23,2025-07-23,190.22999572753906,-0.005801194897021911,0.010093902502083207,How To Earn $500 A Month From Alphabet Stock Ahead Of Q2 Earnings. ,0.0
GOOGL,Google parent Alphabet surprises with capital spending boost after earnings beat,,https://news.google.com/read/CBMijAFBVV95cUxObEhBX3lfWE1xVnJfZjVJc3ZIQlk3UGo0ZnlvNk54M18wVTVDM05IeV9IRmJnTzBJN0dKV0JnXy1sQ1VsTldMN3dnZDN1dllPdnVidGRac1dfYUNVNjdWNWRBOGJoakM1NGlYMzNGTThBTU9sVWU5SjdXV0h6U0toSlNRSWxydlFQWlFMWA?hl=en-PK&gl=PK&ceid=PK%3Aen,2025-07-23 00:00:00.000000,2025-07-23,2025-07-23,190.22999572753906,-0.005801194897021911,0.010093902502083207,Google parent Alphabet surprises with capital spending boost after earnings beat. ,0.8466959595680237
GOOGL,Live: Complete Alphabet (GOOG) Earnings Coverage,,https://news.google.com/read/CBMie0FVX3lxTE8wcEl5NXN1XzhodmhiX3R1c1EydDJqRXpnY1ZLaExLVnhHQmtyR0J6dHQtVUFEYnp1WEo0cDdQQXRYcGlBWHU0XzJHZlloR0tkRldfeERFQzFfWEtpYUcwQzdwdHdIb2JEa2FId3B1aWw4dHI1QkwtVFJ6bw?hl=en-PK&gl=PK&ceid=PK%3Aen,2025-07-23 00:00:00.000000,2025-07-23,2025-07-23,190.22999572753906,-0.005801194897021911,0.010093902502083207,Live: Complete Alphabet (GOOG) Earnings Coverage. ,0.0
GOOGL,"Stock market today: S&P 500, Nasdaq hit records, Dow closes in as trade hopes lift stocks before Tesla, Google",,https://news.google.com/read/CBMi7AFBVV95cUxPVEd3NkVnWWlRa2llQThSV2h3VERUY2Z4ejhWbmtiMmFpNTVwM21FaVg3VlY2MzI5YTFmTGZOYXN2M0lZUjQ4WXBIZXU1SzdJdFYzWV81dVpKbVpscVZRMy1uU0xxWklMclJ4VHA2ZFRPLXlmd01ERDJtb3ZXZ1FsU2IzU1ducUtrWjdETzBHN3RNV2xhQjVBUlN6ekZoaWM4ZEpPZE02QUNlaHN0VnhNNEVaZjJwdGdkWUlLSlVhaUJsbkk5QXhxYVdkeGItQUVkSXpDN003MUlJNUZLYUlEZlR0Yl8tYXFMTWtYbg?hl=en-PK&gl=PK&ceid=PK%3Aen,2025-07-23 00:00:00.000000,2025-07-23,2025-07-23,190.22999572753906,-0.005801194897021911,0.010093902502083207,"Stock market today: S&P 500, Nasdaq hit records, Dow closes in as trade hopes lift stocks before Tesla, Google. ",0.6522497534751892
GOOGL,"Alphabet (GOOGL) Gets $190 Price Target Ahead of Earnings, Analyst Sees Favorable Setup",,https://news.google.com/read/CBMigAFBVV95cUxNQlN2aTBvVUduMnNDdEkyT3hCVHFFNmVnT01yVjQ5eWd2MENuN3FDalJ6MWlHc1FlMUxQTm55dHR5aE1nTnl5WW42N3l3Q3ZFM1lyOTFsQWNlQ3RCc2o5WHlJNGpCZVZiWU5vU0RCdWE5Rmo3UGdsNHNqYWlBN0Y5LQ?hl=en-PK&gl=PK&ceid=PK%3Aen,2025-07-23 00:00:00.000000,2025-07-23,2025-07-23,190.22999572753906,-0.005801194897021911,0.010093902502083207,"Alphabet (GOOGL) Gets $190 Price Target Ahead of Earnings, Analyst Sees Favorable Setup. ",0.9195814728736877
GOOGL,"Google Earnings, Revenue Top Estimates. Capital Spending Guidance Hiked Amid AI Investments.",,https://news.google.com/read/CBMilgFBVV95cUxQZUlrd1hMRFNfT25ldkR5bmZHOVdaTGNXcVBvVUNyYUFLR2hydm9aYU01TThmQzAwdTVkM1BHRVpiOUpPNGtKZ1EyanpfVUhNNmxzbTFOaEMxSW9IWmtkWDl3VGpMNHM0b2t3bkY1UHpmQzg4OGQ2aTVaYzNUT3ZnbjM0VEU3aHlRRF9sdWpvM2pEVXN3Tnc?hl=en-PK&gl=PK&ceid=PK%3Aen,2025-07-23 00:00:00.000000,2025-07-23,2025-07-23,190.22999572753906,-0.005801194897021911,0.010093902502083207,"Google Earnings, Revenue Top Estimates. Capital Spending Guidance Hiked Amid AI Investments.. ",-0.9522685408592224
GOOGL,Here's What You Need to Know Ahead of Google Parent Alphabet's Earnings Today,,https://news.google.com/read/CBMitAFBVV95cUxPOHBrb25uZWRZR2dZd3ZJMk5Wdk9TTFZ2OXgzbk9BNzc4Y0E4YlZhWDFVb0FrZ2dJa09YQUxTWVJsRTRBRHUzNDVDZVFDeG9iTjJMQ1ZTSFlIUDlRYkUwREEwbnFkQmtYYXpsemd0ZEdGbzUybjVRQi1URks5N3hzeXk1ajhQV3hLOXpVT3hpNmtkc1VaaFM3YURGdGE3OWdzZVFVbWNvZ2lKbFZzZjk2WXJVUnI?hl=en-PK&gl=PK&ceid=PK%3Aen,2025-07-23 00:00:00.000000,2025-07-23,2025-07-23,190.22999572753906,-0.005801194897021911,0.010093902502083207,Here's What You Need to Know Ahead of Google Parent Alphabet's Earnings Today. ,0.0
GOOGL,"Google's $85 billion capital spend spurred by cloud, AI demand",,https://news.google.com/read/CBMinAFBVV95cUxOVk9OMl9FNGxUVzlucm9kM05NcTA5YjRDS0dSMENrOUhGVHUtZUgzX0xlQ1lULWJMdUlUOWdoT2tJX1lsOS1FU09wQnFLbWVDc1JxUHg5ZGpISlVqUnlzQXhYT2YtSTg4bGdFSmcxZU9ieFhfRlJkcFJQeTZEaUtyVDZhR01JTTRwU3FkRXFWdU5JZUFhTzUyeENoQXXSAaIBQVVfeXFMUGFERmUxTmZLSTdxR1dHRzZGaDlLSFlRS0RFVmkzTFA5M2VxOHlGWFhBWVVFMzF4NXNTX09MOHdSMVhZdXZjcDAtUXIwSDB2dU9wNlZRWkpOQUdIZXV2bUhyWlRORG5xMExPYk1aUm1nWktyaS1NQURBX01UUUFMRmRpTzMtMUF1LXNwS2h0OF83YmExZTc1cXdNQUJSam9qdzVB?hl=en-PK&gl=PK&ceid=PK%3Aen,2025-07-23 00:00:00.000000,2025-07-23,2025-07-23,190.22999572753906,-0.005801194897021911,0.010093902502083207,"Google's $85 billion capital spend spurred by cloud, AI demand. ",0.7389635443687439
AAPL,Apple Earnings Growth Seen Stalling Amid Dearth Of Catalysts,,https://news.google.com/read/CBMijwFBVV95cUxNQnFyUU5jd2ZRd0FrZFd3WTBxNjVXSzEwSnZiUWw2MS1JeWVNeWY3WVVOaEZlbGtXTTQ0THlJT3ZkcUJkZnFEcDktX3dGb01hLTdKOUhVTWpEWUxYbURRTkhjS3YyWXQtMXd5Q1BhWUVFbnYxeWozNkJUNVdabnFVRFp5VzdFWG1tWG5HTm0zVQ?hl=en-PK&gl=PK&ceid=PK%3Aen,2025-07-23 00:00:00.000000,2025-07-23,2025-07-23,213.9072265625,-0.0011660856188711044,0.0037444714145329423,Apple Earnings Growth Seen Stalling Amid Dearth Of Catalysts. ,-0.9698365330696106
MSFT,"Microsoft (MSFT) Set for Another Strong Quarter, Analysts Say",,https://news.google.com/read/CBMihgFBVV95cUxPb0x6eDJraWRxMEpURFFIaHAzS0lCdjFFd2dZem13RFF2aE1OMVdYeklHd1RicTNjdExNdzUyRE5oV0c2UlQtaUJwamtqOTBfdXRBMFRNSFRpeHRJWW1yTnd4T19GVDBpZXFJUjV4cHJUMUd3QWp1SzhURS1tWUdVTVIxNEtVUQ?hl=en-PK&gl=PK&ceid=PK%3Aen,2025-07-23 00:00:00.000000,2025-07-23,2025-07-23,505.0397644042969,0.0011875122281272965,0.006720045476142969,"Microsoft (MSFT) Set for Another Strong Quarter, Analysts Say. ",0.95155930519104
AAPL,"Apple Is Going To Surprise Wall Street, Says Tom Lee, As iPhone Maker 'Could Be Quietly Ready To Pounce On AI'",,https://news.google.com/read/CBMihAFBVV95cUxOYkJVNnFBOEpxMDRnWTk5NE45QzNGYjQySUFxakZTNDQybEliMHRVMGhkRi03ckxpQUs3cnJsNzhmbEVhcVpHdUNxSVJsb3U1M19FQ2lSb1F0cFJFRHJXTG5IU0p2Rnk1b2Y5SF95d0FqU2V0S1VFYTZNRkRzT0dEZ3pwR3A?hl=en-PK&gl=PK&ceid=PK%3Aen,2025-07-23 00:00:00.000000,2025-07-23,2025-07-23,213.9072265625,-0.0011660856188711044,0.0037444714145329423,"Apple Is Going To Surprise Wall Street, Says Tom Lee, As iPhone Maker 'Could Be Quietly Ready To Pounce On AI'. ",0.8251923322677612
MSFT,Microsoft (MSFT) Reports Next Week: Wall Street Expects Earnings Growth,,https://news.google.com/read/CBMihAFBVV95cUxNcTBXc19feUY1X0NaTUV6QTVjal8xYVBxcUtqUDhrZmptYktwQk5BSGJ0OG95c0paanNRNlJrSjNQX1VxdzBWN0tMbVY2dUdPVlNUclJxS0pvQU5LUWpDUzlTRXBaUXN1UnBid3BSSmhIQzZXZjVPSnV2MmV0S05KWW1BbXk?hl=en-PK&gl=PK&ceid=PK%3Aen,2025-07-23 00:00:00.000000,2025-07-23,2025-07-23,505.0397644042969,0.0011875122281272965,0.006720045476142969,Microsoft (MSFT) Reports Next Week: Wall Street Expects Earnings Growth. ,0.9495738744735718
AAPL,Apple (AAPL) Stock Rated Hold as HSBC Flags AI Letdown and Tariff Risks,,https://news.google.com/read/CBMifkFVX3lxTE1uVTlGTVBfTXpzT1pBcWdiUTJHNWNnZVQwQ21lUThFcU1BR1dNSkdoX0tVdWhyTnR6bVBJdjNxUTc5RE91YXpIRjlFYzZYVWdJdVpRZTZGLTZGRTdGLUp4X2RrWFB1bHlUdzhpVkdvRkpnalFMUHBwRHpCNW0tdw?hl=en-PK&gl=PK&ceid=PK%3Aen,2025-07-23 00:00:00.000000,2025-07-23,2025-07-23,213.9072265625,-0.0011660856188711044,0.0037444714145329423,Apple (AAPL) Stock Rated Hold as HSBC Flags AI Letdown and Tariff Risks. ,-0.9456084370613098
AAPL,How To Trade Apple Stock Ahead Of Q3 Earnings?,,https://news.google.com/read/CBMie0FVX3lxTE5KcDBERFBNeHZXYWFhRmFGb0haMERMR2U2cF9BdHlYaUVPWFJfUmRrdGtFQWlTbTlJNnRwWWZwbTBnT25vbkI4cjVHNkliUTRabXhnVTFzdUFSV0RoSmtFQU4wMDdCNGhwTmtTZDlMakZFT0ozb2VYSzBXWQ?hl=en-PK&gl=PK&ceid=PK%3Aen,2025-07-23 00:00:00.000000,2025-07-23,2025-07-23,213.9072265625,-0.0011660856188711044,0.0037444714145329423,How To Trade Apple Stock Ahead Of Q3 Earnings?. ,0.0
MSFT,Analyst Explains How Microsoft (MSFT) Stock Can Reach $600,,https://news.google.com/read/CBMiiwFBVV95cUxOdWFhT21qYTM1LVd4b3NHRVlwRlAzQlQtVEQ5SEtGQm84My1qRTNmSFlHRHhIMVZLdlpNRjhrV1dUWThXdW92aS1qUFl0RTlwZ3kzSGktYnQ0cVVnbXNNTEdoYnprS1JERHpPa3Q1MVB5S09nQUEyazBpTXMzdHhMcmp1blNCOW5qVGg4?hl=en-PK&gl=PK&ceid=PK%3Aen,2025-07-23 00:00:00.000000,2025-07-23,2025-07-23,505.0397644042969,0.0011875122281272965,0.006720045476142969,Analyst Explains How Microsoft (MSFT) Stock Can Reach $600. ,0.0
AAPL,"Apple (AAPL) iPhone Demand Drops in June, UBS Sticks With Neutral Rating",,https://news.google.com/read/CBMiggFBVV95cUxQZE80YXBnNi12elc2NW1BcVdjZUk5WERIX185b3ROcFRCSk9UWkdMRGVaVjYzcVhQRWREb3MyWHpVMzNiZFd3dTBic3RqelMtUDFPV2lOejVoMlRHTTlYam5aUUJmdE15YjdLOGt1WXBuWjFyc3M2RkR2NFdpUDdublVB?hl=en-PK&gl=PK&ceid=PK%3Aen,2025-07-23 00:00:00.000000,2025-07-23,2025-07-23,213.9072265625,-0.0011660856188711044,0.0037444714145329423,"Apple (AAPL) iPhone Demand Drops in June, UBS Sticks With Neutral Rating. ",-0.9675556421279907
AAPL,"Apple (AAPL) Analysts Stay Positive Ahead of Earnings, But AI Clarity Still Needed",,https://news.google.com/read/CBMihgFBVV95cUxOOEFVNlpJLU5yY3ZhZXJsLXM1MGNOUU55aU9zeVpUQnRfRjgtZzRrY3J3Vm5FMHBhZzIzZzBNRDFKMGw4bUkxMmczbVVLZnhSNlFvZFo1Rzd5b0VwOGQyU0p5YkZ4M0FSTGdZRkhPb2xVZTRaZ1dJMGVTRjhNdTBGdnIzUlpZUQ?hl=en-PK&gl=PK&ceid=PK%3Aen,2025-07-22 00:00:00.000000,2025-07-22,2025-07-22,214.15695190429688,0.009036182474420285,0.006977131695491489,"Apple (AAPL) Analysts Stay Positive Ahead of Earnings, But AI Clarity Still Needed. ",-0.6876402497291565
MSFT,"TD Cowen Raises Microsoft (MSFT) Price Target to $580, Reiterates ‘Buy’",,https://news.google.com/read/CBMiggFBVV95cUxPVHJsSzU0LVZ3M3NuMTVPWW5kMnhMMWJBM0VBdlloUUZ5VGUxYk50amV4Nnd6MmVwRHRCNS15THFaVU54aExtUW8tb0NPNmFHcGNKRXQ3VHhHMWRKdGN0dXk5RXhQVl9EZEpjNGhNQjVyaFcxaHRUNzhBNkktOTFhRXJB?hl=en-PK&gl=PK&ceid=PK%3Aen,2025-07-22 00:00:00.000000,2025-07-22,2025-07-22,504.44073486328125,-0.009391045243034468,0.006737877625013563,"TD Cowen Raises Microsoft (MSFT) Price Target to $580, Reiterates ‘Buy’. ",0.0
MSFT,Barclays Raises Microsoft (MSFT) Price Target on Strong Software Outlook,,https://news.google.com/read/CBMiigFBVV95cUxNX0F0ckZnYW0tZ2dBZ0R1X0hiQVg0Y3d4bkpxTjhvTGQ3ZWFtaGlQc2Y3WUZlYTNwSDQ5eTBEMkJpcUhITUFHOGVWa29QblpFMkJJdFpNRDMtTVV3blpPYWpzeUNkVTR2OHEzSUwzajZhdmRIUnNNOWxSNGVxc0xVWmdseDJURmFTR1E?hl=en-PK&gl=PK&ceid=PK%3Aen,2025-07-22 00:00:00.000000,2025-07-22,2025-07-22,504.44073486328125,-0.009391045243034468,0.006737877625013563,Barclays Raises Microsoft (MSFT) Price Target on Strong Software Outlook. ,0.9210363030433655
MSFT,Microsoft Corporation (MSFT) Soared as Azure Revenue Grew 35%,,https://news.google.com/read/CBMijgFBVV95cUxOa3pZZk1ETEM0WjBVd1puSF9QZ1d2bnItMklzQ2Vla2NPWUhoaFhMQng3NXM5ODJiMlN0UG9EUDMtTVpidDhDQk90RGNfM3VkQV9feFFZOGhzZ19ocG1IcnVnU2hNbVZvMzRKSTZCRlBsZnNDcWFST0pUNE1MMm5hallQaE90N2RfQVNOTFNB?hl=en-PK&gl=PK&ceid=PK%3Aen,2025-07-22 00:00:00.000000,2025-07-22,2025-07-22,504.44073486328125,-0.009391045243034468,0.006737877625013563,Microsoft Corporation (MSFT) Soared as Azure Revenue Grew 35%. ,0.9546148180961609
GOOGL,"Alphabet (GOOGL) Poised To Deliver Modest Earnings Beat, Says Evercore ISI",,https://news.google.com/read/CBMiigFBVV95cUxNekNXZWJFMU9HM3JtQjhmdm1BU1ZOVDFrOEJGTzdjLXNrRXpKNkV3NlEyenN1Y1FJOWJWUm0wbUlrblM5bDdscGMtV29ORF9qaVNCNnZna1Y5WTN1dUpRTUZUa0FnQWN6UHUySHpYQVhpR2NsTFh4MG9IV3ZyOUVQRmV3R3NiZHNoUXc?hl=en-PK&gl=PK&ceid=PK%3Aen,2025-07-22 00:00:00.000000,2025-07-22,2025-07-22,191.33999633789062,0.006522831112902638,0.008459749391485496,"Alphabet (GOOGL) Poised To Deliver Modest Earnings Beat, Says Evercore ISI. ",0.9511314034461975
GOOGL,GOOGL Earnings: The Cheapest of the Magnificent 7,,https://news.google.com/read/CBMiiwFBVV95cUxPZzdkZzJhd3BTdUxCYjZ5eWZnZUV6bENld0x6RW9Wbk9fUFN1RnVYdy1vRWhuZFZ0UWMtTzdwb2ItNGdNNW0xU2ZLNGU4MW5GX1BLYTRJNnRHdnZzYWZxaUZnTHY0SVBhRGhxRF9hLVUxb3RfVzZYdXdERXUybnJXeG1GTTJncTdHbTZB?hl=en-PK&gl=PK&ceid=PK%3Aen,2025-07-22 00:00:00.000000,2025-07-22,2025-07-22,191.33999633789062,0.006522831112902638,0.008459749391485496,GOOGL Earnings: The Cheapest of the Magnificent 7. ,0.7092035412788391
GOOGL,Here's How Much Traders Expect Google Owner Alphabet's Stock to Move After Earnings,,https://news.google.com/read/CBMiygFBVV95cUxNNlBLYW9yQ3lJU2haQ0ZwbWF5MjZtQlJuOTJERE1tZmdrOW1kY2UxRVZ2Slk5WDYtQzZXakpmc0dISVJFcFVIaVl4cFJ5V2J5Q2Z3UWp3Y0pFbVZUc1U2MGNycGI5N2F6b1NWUEtZU0M2NUZFMzhfY29KQlRNbW9FS3BmOHp5LWcyYzdGNGowdXZqT3N2RDJ6dUZSOHVYVF9lQTRWNU1HMl9zMUxENXloWnVncXRvOF9ROExrel9RcG5qT1Y3R29kNzln?hl=en-PK&gl=PK&ceid=PK%3Aen,2025-07-22 00:00:00.000000,2025-07-22,2025-07-22,191.33999633789062,0.006522831112902638,0.008459749391485496,Here's How Much Traders Expect Google Owner Alphabet's Stock to Move After Earnings. ,0.0
GOOGL,Morgan Stanley reboots Alphabet stock price target before earnings,,https://news.google.com/read/CBMipgFBVV95cUxQTTlHZ2ExQi1jWHZZTTNacW9sMDdMTGdQUl9HcVRzS1NEUm1oZWQ3a2lkbE5oZE0taWU2Z1ZGZzFWdzlfS3lVR0YyMVhsYmZSNmp5Q1lmaFo1UVhDOUZMeEdhYUpyWXRucTcwNnBBSWhyU1EwQWxoeUpPM0ZLOGZMYkE4NmlKWDlpMmxKb1c5OUxOTHVDNDZSdWZablMyc3o3d25sQVd3?hl=en-PK&gl=PK&ceid=PK%3Aen,2025-07-22 00:00:00.000000,2025-07-22,2025-07-22,191.33999633789062,0.006522831112902638,0.008459749391485496,Morgan Stanley reboots Alphabet stock price target before earnings. ,0.0
GOOGL,"Stock market today: S&P 500 ekes out new record amid wave of earnings, trade updates",,https://news.google.com/read/CBMizAFBVV95cUxOZjRDVXBGWFVGaHRwZGxPcUcwVDhLQndEeU9iSFBZYUs2VndtMjFIYzRaUElYLTc4RkJZelg3YjAzNG5vRnF1bW1yT1UtcEJ2NzN2NjRucktmd01WV21RQTlHcWNrVHVqUlF3djZPZ3hSNXA1WWFROS03Q3ctZjF1VlhNcFZRbjRVaWYwQlRmaDRqZEhYQWpSQnRPaTAxOXkzUzE1Z2lyM3pkMVFnUlVDeFNhLU9CV256aFQxVmk2ZVNQamJpbzh0WmdsN3Y?hl=en-PK&gl=PK&ceid=PK%3Aen,2025-07-22 00:00:00.000000,2025-07-22,2025-07-22,191.33999633789062,0.006522831112902638,0.008459749391485496,"Stock market today: S&P 500 ekes out new record amid wave of earnings, trade updates. ",0.8798584938049316
GOOGL,NBIS vs. GOOGL: Which AI Infrastructure Stock is the Smarter Buy?,,https://news.google.com/read/CBMigwFBVV95cUxNTzFjcWUzeHQ0M0tJT19kR0lUMmN0bC1OMEZwSGRWWWJuSkpsaWd1RUVmWjZZamwzbkRkRGNMTXNlbzVpUHFmN0hUY2hwOERyNFZpOUMxM2tsVzBFOE4zVlNBN3ZhWjRrV3FKX0JQaUR5M3Q3TFhaeGxmRmtmeDk5Ym50VQ?hl=en-PK&gl=PK&ceid=PK%3Aen,2025-07-21 00:00:00.000000,2025-07-21,2025-07-21,190.10000610351562,0.0272344569945544,0.008658460968674227,NBIS vs. GOOGL: Which AI Infrastructure Stock is the Smarter Buy?. ,0.0
GOOGL,"Tesla, Alphabet highlight earnings rush as market hovers near record highs: What to know this week",,https://news.google.com/read/CBMi2gFBVV95cUxOdjVPQi04VnI5dDJzVFNXYTlCLTR0cUdFMGV0MFRMWE54TnNXS0g4NlBFZHVRS18yTVBUd0RiMUtiYmhERWlxdEpwX1Vna1BCQzRPcGJNSkg1TnZscUd0dkVEd2JxbHpUcHd0dTVRVGRBSTgwYmtNX0dHMHRBNXRkZ0tkQzNKTnlsQkhxaF82bzVxek5sZXZtVzRPN1gzdjBPMGFzeWpzVUNsR2REUWJpa3lrOG8xUWdRa0NTZ3dWLVFYOGwtS3dsdmV4LXZ2WGVUSVR4a1FpVndzZw?hl=en-PK&gl=PK&ceid=PK%3Aen,2025-07-21 00:00:00.000000,2025-07-21,2025-07-21,190.10000610351562,0.0272344569945544,0.008658460968674227,"Tesla, Alphabet highlight earnings rush as market hovers near record highs: What to know this week. ",0.0
GOOGL,3 Dirt Cheap Stocks to Buy With $500 Right Now,,https://news.google.com/read/CBMikgFBVV95cUxNRWdySE5XV25HRk56NUNiaVZGYzNOMzVSTHhzRHhhZE9EejY2ajNOZ1FDSmZJQ0N0NTdMb1V0Rjg2WXozR2FYbHZ3QkpMU3I4NUFGNDFjaE1ZRWstWEZ4YzJZYk50dHRHVFhzUllxTVRPLWdqVlNQdE1YNnBhQ01fSFJlakFza2tkYzlIQk0tdWw4QQ?hl=en-PK&gl=PK&ceid=PK%3Aen,2025-07-21 00:00:00.000000,2025-07-21,2025-07-21,190.10000610351562,0.0272344569945544,0.008658460968674227,3 Dirt Cheap Stocks to Buy With $500 Right Now. ,0.0
GOOGL,"Going Into Earnings, Is Alphabet Stock a Buy, a Sell, or Fairly Valued?",,https://news.google.com/read/CBMiogFBVV95cUxOUTkxX29uR2hUVXZvWnpwbDlubEtJYnF4cDlCeGxZRGczX3RvN1VqUm9kRUNpTTNpaGtobFFKRjdSMlBhNHhPUl85cjNkTnRCdTYyTmNqekFIY2pIUUVTQWtYcWExRV9HM1A0V2xOeHVNNHdUaEhoTkl3NV9FVHBaUUpGMUl1U3V2S0F1MHhLMlhjWmdqN3dja1hKUGk3aE40UlE?hl=en-PK&gl=PK&ceid=PK%3Aen,2025-07-21 00:00:00.000000,2025-07-21,2025-07-21,190.10000610351562,0.0272344569945544,0.008658460968674227,"Going Into Earnings, Is Alphabet Stock a Buy, a Sell, or Fairly Valued?. ",0.0
GOOGL,What Gamma Exposure is Saying About Alphabet Stock Ahead of Earnings,,https://news.google.com/read/CBMiigFBVV95cUxPQmZNRmt4cjVwVHpkWHpoS3JZV3B6Um1iOWVORmxwMkRsM21DeDhPT0lqU1J6U1BhRVlfVktrV3BTNE5HVkgwNDZWOVUtR2Z3S2MtVW9laER1dncyVEZRbXhtUWQxdm1XUTd5TWVMd2FsZExGZkt1cDhPTW5TamlNZ2VxZDZsdzBhREE?hl=en-PK&gl=PK&ceid=PK%3Aen,2025-07-21 00:00:00.000000,2025-07-21,2025-07-21,190.10000610351562,0.0272344569945544,0.008658460968674227,What Gamma Exposure is Saying About Alphabet Stock Ahead of Earnings. ,0.0
GOOGL,Watch These Alphabet Price Levels Ahead of Google Parent's Earnings Report,,https://news.google.com/read/CBMirwFBVV95cUxNVWNxYlp4ekFhN3NwZG5DWUFtV2U3QmJobzN0MWs4emNVTm9ZZzYydndJVUI2ZldFcUJ4WjBjbHZPUFRsdm9lelN4TWtDdkl4QmhTVnd2d3FrNWFRbE9GdWNoRlhMTmQ3RjhzajAwbmtGY3RyMTY1Und0M2Vjazd0X01mWFMwSi01Rkw4c0VEbU9aWmV2Q2dZa2dJQ2x0eklnZk9VcWJsWFJsWkl6Wm5n?hl=en-PK&gl=PK&ceid=PK%3Aen,2025-07-21 00:00:00.000000,2025-07-21,2025-07-21,190.10000610351562,0.0272344569945544,0.008658460968674227,Watch These Alphabet Price Levels Ahead of Google Parent's Earnings Report. ,0.0
AAPL,"Apple Inc. (AAPL)’s “Got Game,” Says Jim Cramer",,https://news.google.com/read/CBMieEFVX3lxTE42cTFoTF9DSmh6OU1LRXBzX2xNbVdsV0x2N3NtNGtzby1yajJCcU5VMDdXSDdjdkx2NDJCLUxCb21JaTF6WEFXTW1jUldCUjZKWWpzVXdfM0NPeXpYSGtaYU11MzBPWTc2RmdQeUFYcm9razNLMmVhQw?hl=en-PK&gl=PK&ceid=PK%3Aen,2025-07-21 00:00:00.000000,2025-07-21,2025-07-21,212.23912048339844,0.0061558702516160135,0.006817468559598398,"Apple Inc. (AAPL)’s “Got Game,” Says Jim Cramer. ",0.7632482647895813
AAPL,Should You Buy or Sell Apple Stock Before July 31? The Answer May Surprise You,,https://news.google.com/read/CBMimAFBVV95cUxQYl9EbmFoT1pUQkQ2NzFHS3c3V0l3X3U2ODdRQUlyTkxiMEhjU3M2NTdFQWlfYkwtZ1lhYi12Wlk3YkdDMWNIRXRycnpmVGZCdnBUa3hsWjdEeWN3Wk1oeExGOHpLMTJQN3JodXoyVDRSYm1GaHcwdFhuSzM3aTdaZVhhaXBUeEt5Qi04Z05xZFBXeFJTNmF4Sg?hl=en-PK&gl=PK&ceid=PK%3Aen,2025-07-21 00:00:00.000000,2025-07-21,2025-07-21,212.23912048339844,0.0061558702516160135,0.006817468559598398,Should You Buy or Sell Apple Stock Before July 31? The Answer May Surprise You. ,0.0
GOOGL,Alphabet Reports Q2 Earnings July 23. Time to Buy GOOGL Stock?,,https://news.google.com/read/CBMihgFBVV95cUxONXA3Yzl3aEJBLUxwaHlfUzE1TU95eXhQMlpnSFJNMVRtVFA3RjRHcmppZDJHQ2NITTlxQUZYc2VkQWdENlVFeDBEVnNhRmdOUlBZcDNlMkJNSlRVRG5aenk4amx3LTRVZEJhM0xuNGl3UkhHWnJwSGhENnU3RHBTYVlDMWxfUQ?hl=en-PK&gl=PK&ceid=PK%3Aen,2025-07-21 00:00:00.000000,2025-07-21,2025-07-21,190.10000610351562,0.0272344569945544,0.008658460968674227,Alphabet Reports Q2 Earnings July 23. Time to Buy GOOGL Stock?. ,0.0
AAPL,"Apple Stock Forecast: As Critics Call for Cook to Step Down, How Bad Are Things Really for AAPL?",,https://news.google.com/read/CBMihgFBVV95cUxNdU56UDYzY2VoV3FsRmszbHBCM3BtUmdCYjlsWGNkUDJUNTY5c3Fqc0xRZlNiWWpiQ09jeHVmMWhIc0NETkVhdm4tTTVPN2d2dGJOVTh1dGtHd1dBMVpGMVltOFB5OVNtU0VpeWx5WlE5dmFqckotT2NEUFJoQmpIMlczMnNBZw?hl=en-PK&gl=PK&ceid=PK%3Aen,2025-07-21 00:00:00.000000,2025-07-21,2025-07-21,212.23912048339844,0.0061558702516160135,0.006817468559598398,"Apple Stock Forecast: As Critics Call for Cook to Step Down, How Bad Are Things Really for AAPL?. ",-0.9072808623313904
