ticker,headline,summary,link,scraped_at,date,Date,Close,daily_return,volatility,text_for_sentiment,sentiment_score
GOOGL,Google's market value surge - how to invest now?,,https://news.google.com/read/CBMiekFVX3lxTFBOdjdhMGNaQWhZWnlnUEh3RWtQWlhjZkFUazNsRl9sWkZnR3dGQTlMNHNJeXpXMWR2RkhkZDVoRG0wT1BWR3JKNnlZR25kZk5ma0NraW4xMHhIaDQ3SVV5Sy1iNHVpaGtBcWlIdUFLZEJWYXB0MUxEV1l3?hl=en-PK&gl=PK&ceid=PK%3Aen,2025-08-25 22:03:28.665076,2025-08-25,2025-08-25,208.49000549316406,0.011645442272406825,0.01460086798802256,Google's market value surge - how to invest now?. ,0.0
AAPL,Apple (AAPL) vs. Amazon (AMZN): Which Is the Better Buy?,,https://news.google.com/read/CBMihwFBVV95cUxOeHNYSzdPbnFmb1drV3BOWFhVLUhGMUFEXzIzUjZtX0toM2pfQS1waE5MWWo1eDNCbzFfT1hyUE15UnJkY3d1a01PSWptdVdnaUkzeTc5aXRfOVVkdTVfQWdvRFhhRDdQRFNnSzVUSEZfVVhPZUFjYzAwbFFwNjc2Ri1lQjNBXzg?hl=en-PK&gl=PK&ceid=PK%3Aen,2025-08-21 22:03:59.726656,2025-08-21,2025-08-21,224.89999389648438,-0.004911289931109564,0.010431839617819325,Apple (AAPL) vs. Amazon (AMZN): Which Is the Better Buy?. ,0.0
GOOGL,"Terawulf (WULF) Cracks Past New All-Time High on Expanded Fluidstack Deal, Higher Google Financial Backing",,https://news.google.com/read/CBMiggFBVV95cUxQYjFXaERhUDJqOU9TRHRWZlp4bkx0RDM3dEZvVWVZX3AwcEpLaFhzM0xaY0x4ZXNlUkl5cmc2LTI4VlYxN21oYVpFWU9EcGYyLUNfTE95VFZaQkRRS0RMR2ViQWpLQ3JFUWdXaFRLTWd6LWdIRHpuZnJTODRWZ2RqVVFn?hl=en-PK&gl=PK&ceid=PK%3Aen,2025-08-19 22:04:23.652763,2025-08-19,2025-08-19,201.57000732421875,-0.009483993492782505,0.00736587613626913,"Terawulf (WULF) Cracks Past New All-Time High on Expanded Fluidstack Deal, Higher Google Financial Backing. ",0.9392257928848267
GOOGL,"Florida is now the 2nd most financially distressed state in the US — topped only by Texas, Google helps reveal",,https://news.google.com/read/CBMihAFBVV95cUxPSXRSTGZpYUNveF9jRmlUeWNyS3BlV2FDdVc5cXU0VlRMRFQ2Tk0zQmpZMEFMYTFaS25vQ3pwaG8xei1JZ2ZGN0FVZ0RJVzRCZEJWTU5lWmI2TnhnaklpbjRwLXFaMFd3SEZrQlNjUnYzTWd2ZC1fRW0xY2pTMGUxQVF6RkM?hl=en-PK&gl=PK&ceid=PK%3Aen,2025-08-19 22:04:23.652763,2025-08-19,2025-08-19,201.57000732421875,-0.009483993492782505,0.00736587613626913,"Florida is now the 2nd most financially distressed state in the US — topped only by Texas, Google helps reveal. ",-0.938509464263916
GOOGL,FTSE 100 up and US stocks mixed as Zelensky-Putin meeting takes shape,,https://news.google.com/read/CBMirAFBVV95cUxQTm83MHlnMGVoWUpWTjdIeVIyNi1GU2N5VllJbFVRMWc4Q1hmY2w1Tk1jSWdSNlFzc2JRRjBlam53MlJkMUVGc2MzVG5IcDkwNGFqeTJCQTZWZzNlSkVNYWtmVlhxaWN4NHBhY2xSZEFBTEkxTUpKcXI1YnVCSnRiVm1HTUtyTG84dmVPVW9USUdlSDNmcGlxS0FOVENrd0FZUTcteFdXdHNFcjc0?hl=en-PK&gl=PK&ceid=PK%3Aen,2025-08-19 22:04:23.652763,2025-08-19,2025-08-19,201.57000732421875,-0.009483993492782505,0.00736587613626913,FTSE 100 up and US stocks mixed as Zelensky-Putin meeting takes shape. ,-0.896507978439331
MSFT,Stock Picks That Billionaires Love,,https://news.google.com/read/CBMinwFBVV95cUxNbVV0bXN1TkpqMHEwZF9SWWE1a29iLW9ndHVQMW81bUhjUzhkQXhTb1pvX2lDT0N4WmJ4SkdiTVc4Z3FCaGxFODNLbnl0akszNmRBdHZucU9HY1RmWHZTZ3V3SGFoNjVBTUVUcS1ZTG5peFJFSVI0VjZpTjk1Ymp6cVo0MkdhSnYzYmtEd0Y4TFJSMzROaG5DR2RGTVp1bUE?hl=en-PK&gl=PK&ceid=PK%3Aen,2025-08-19 22:04:20.281064,2025-08-19,2025-08-19,508.933349609375,-0.014175136000177835,0.01051436611954413,Stock Picks That Billionaires Love. ,0.0
AAPL,"Nvidia is the most underowned megacap stock, Morgan Stanley says",,https://news.google.com/read/CBMirgFBVV95cUxQbW1LYmVWZ3ZSM0N3WVFXTnhDNnFYcnBURUNwMWtiaEo2dThWOVpoTTA1bWlxWkZYc3UwOGZjamw2Q2VCUDhsbHNpMlVMdm9oT3NTMDVmUVdyTVlsNC04anMwcE9YWlRtSW5lc0ZLbm1OOUNmZzE5cGoxN2NmUXNiVXhYZmR0dGNxU2pYZlVTaHNNbjFsakRReEdBT0tnenlFWDd1cmR3Vk1kdHpQd1E?hl=en-PK&gl=PK&ceid=PK%3Aen,2025-08-19 22:04:16.889066,2025-08-19,2025-08-19,230.55999755859375,-0.001429259958971918,0.008954312109057158,"Nvidia is the most underowned megacap stock, Morgan Stanley says. ",-0.949907660484314
GOOGL,Alphabet (GOOGL): 3 Reasons We Love This Stock,,https://news.google.com/read/CBMijgFBVV95cUxQTF9yQmNHZ09BajJvb2UybXBtZUphSXN1V01LNkVjWE5lMnJpQURobEE3TkU0cW5tc215dm04QzhsTWp4ZHh6Q1Q3MzNDY0hKS1M0WF9EQ3l2NHNkMlRfcEd0UE1rNVE0UjhDWS00bEx5SFdtbmJnLXdPWlVoYjViNk10N25GSHR2Z0stN3RR?hl=en-PK&gl=PK&ceid=PK%3Aen,2025-08-18 22:04:32.620790,2025-08-18,2025-08-18,203.5,-0.001961716078753062,0.010639072339997295,Alphabet (GOOGL): 3 Reasons We Love This Stock. ,0.0
GOOGL,Google Lifting Stake in TeraWulf With Additional $1.4 Billion Backstop,,https://news.google.com/read/CBMipgFBVV95cUxQVzh4NTJYOVd3M2tYd1Z1aTNHVFc5bU1rUG1xQ1dIcW1zQy1Odl90MWtUZHNLakJhN1dYQUZLU09mUlFKWnYyRklrajlxR0dTUkttSXdqc1FOZERXTDN4X0hMYks0dW5fM1VPRHZmdl84aGg3UE5ESF9aX1dCOGJWdklNWUVudFlrcGNYdFVUN0dOVW1OY0RDdFNWQXZsaGltLTJMRzd3?hl=en-PK&gl=PK&ceid=PK%3Aen,2025-08-18 22:04:32.620790,2025-08-18,2025-08-18,203.5,-0.001961716078753062,0.010639072339997295,Google Lifting Stake in TeraWulf With Additional $1.4 Billion Backstop. ,0.0
GOOGL,TeraWulf stock jumps as Google ups stake in bitcoin miner to 14%,,https://news.google.com/read/CBMirgFBVV95cUxPQnJYV3J1Mkg2MjEtR1g0OUFxM3NfS0RzeldORzUwdkhMNUdob1c4VG51UFptaXlHN2o0MER6bG5pTjFkY0ViRzEyQ245OXRtRFlVbDFLY2JDR0xTNjRNYi15bE9OLXFYaWIxRllhRVhMSlBUaHZ6QzBzMEhHV0hZY1B1N0RWWmlPREpjYU1WQ25rYTktZ1RlQ3E4elNpV0FyNWtlNW1OZ0NNaDc3N1E?hl=en-PK&gl=PK&ceid=PK%3Aen,2025-08-18 22:04:32.620790,2025-08-18,2025-08-18,203.5,-0.001961716078753062,0.010639072339997295,TeraWulf stock jumps as Google ups stake in bitcoin miner to 14%. ,0.8631088733673096
GOOGL,"Solar stocks, Tesla, TeraWulf & Google: Trending Tickers",,https://news.google.com/read/CBMiiAFBVV95cUxQVUxzdWdwUHJJNVRVOVUxM0RXT0txRzhULUlGeGZpYU1KZ1pfd3FsQmpyUG9Od0RlcEw0SVR5Y250RE5ZcTFkbWYxWGE4b0FhZ25oRFlobkVKZVVjVURaRjJMOE5aVDBtRGVUNnNGaG44MzY5amNfa3hWUVlrSFV0MDBsM1ZNVkJj?hl=en-PK&gl=PK&ceid=PK%3Aen,2025-08-18 22:04:32.620790,2025-08-18,2025-08-18,203.5,-0.001961716078753062,0.010639072339997295,"Solar stocks, Tesla, TeraWulf & Google: Trending Tickers. ",0.0
GOOGL,Google Is Betting Big on Terawulf Stock. Should You?,,https://news.google.com/read/CBMihgFBVV95cUxQeVZXckdkVi1WSWtyNElzSXFmUXkyOXVpSmRRR2JLNktGaDQ2RFBDZlEyTTlUWUdMeFdaWGY1bGZwQWtfT2czbzJfMkk2OVJyVDU0ZGJDVUUzdU1XMElvNXVSS1ZyV3ludzIwSEZrbm5GTU5taGlTRHd4UDkweHN1ZHNOX0c2Zw?hl=en-PK&gl=PK&ceid=PK%3Aen,2025-08-18 22:04:32.620790,2025-08-18,2025-08-18,203.5,-0.001961716078753062,0.010639072339997295,Google Is Betting Big on Terawulf Stock. Should You?. ,0.0
AAPL,"Warren Buffett’s Berkshire Further Pares Stake in Apple, Adds UnitedHealth Position",,https://news.google.com/read/CBMiiwFBVV95cUxOMjk4bVpHaW9HeDBDcHBoaW92QUh6Ym10d0dlZXZiREZMXzJUZHNQbVIxTXBKWnBNNWNubERrRWFrbUVnQ0NPUUtZS2R3VGNjZ2l0c3hSaWFhVS1lakhNZGo1WmVDR2dQRUtnWDhKWjh0R1JRR1d5ZDd0SnVBamxpMGVlOW16LS1jM3c0?hl=en-PK&gl=PK&ceid=PK%3Aen,2025-08-15 22:04:53.386382,2025-08-15,2025-08-15,231.58999633789062,-0.005112133549474374,0.01933564677159003,"Warren Buffett’s Berkshire Further Pares Stake in Apple, Adds UnitedHealth Position. ",0.0
GOOGL,Alphabet Stock (GOOGL) Gets Buy Reaffirmation as DoJ Case Looms,,https://news.google.com/read/CBMigAFBVV95cUxPcEZzSFFFSjFxNGQwNXUxQXFjNHd0dUVwS3VKVTl5bV8xMmxkWVRQb09peGd3UnFUUGE5VDlzcEZJb2pmUXdqenRjR0tIS21yY2cza1RRRl9FVTVMOGdnT0VKWnhLaUcySERiUm1kTmQydmJaUzdwdW1aWHl5VVZ2cw?hl=en-PK&gl=PK&ceid=PK%3Aen,2025-08-14 22:05:07.899031,2025-08-14,2025-08-14,202.94000244140625,0.00485242471261893,0.010301073863100307,Alphabet Stock (GOOGL) Gets Buy Reaffirmation as DoJ Case Looms. ,0.4418920874595642
GOOGL,Crypto stock surges 35% after bagging a deal with Google,,https://news.google.com/read/CBMinAFBVV95cUxNbHF2X09xNWVhNlgwVTI2US0wUDAwaUlGY1RkTHRSQ2Y4cWsyNnI0VU9DRDRudnF4WkVWcnZPLUY0QVJ6aGIySUZnU0xPWU5XYU9GYllHa1hNT0RKOWs4cXU0R3JSVTlqNmJMSVEteWxaM29tMDhpOGRwYWdyT2dpaDdNZVZuU1c1blFCUEpTOVFoSmJLc21DakV3THI?hl=en-PK&gl=PK&ceid=PK%3Aen,2025-08-14 22:05:07.899031,2025-08-14,2025-08-14,202.94000244140625,0.00485242471261893,0.010301073863100307,Crypto stock surges 35% after bagging a deal with Google. ,0.8459551334381104
AAPL,Warren Buffett’s Berkshire Hathaway offloaded Apple shares again in second quarter,,https://news.google.com/read/CBMicEFVX3lxTE1tQ3VzSk9sOVFDc09CTTZ4QUI0Ny1obTV0cEFEZGFucWRjZkZfOG04cTJNdk9CaEdlQ0dCMEVvQzNpS3hTVDc4aUZjQWhYcUc2Zm1xdk9EMnctcUVCaG1JVnJUSWNzZmdVWElacG9jNnc?hl=en-PK&gl=PK&ceid=PK%3Aen,2025-08-14 22:05:02.925704,2025-08-14,2025-08-14,232.77999877929688,-0.0023571895917441354,0.022345547885951514,Warren Buffett’s Berkshire Hathaway offloaded Apple shares again in second quarter. ,-0.9493970274925232
AAPL,"Warren Buffett buys battered UnitedHealth, sells more Apple stock",,https://news.google.com/read/CBMihwFBVV95cUxPcmZXdmVReHNadVJXY0ZnSDZfbWFVRkZwRU1tbWJndEdieFNPeTZaNkZKRWlxRTVuS2cwdHhCZlk3ZWhJaDhyaUdkZXhmUUxDSHFHbVJLaFdKNVlVNUszM2lSNGg3aEd6VUJTSnhxS3R4RElRMllxcHl2RGJodUtYWFJSUGIzUEE?hl=en-PK&gl=PK&ceid=PK%3Aen,2025-08-14 22:05:02.925704,2025-08-14,2025-08-14,232.77999877929688,-0.0023571895917441354,0.022345547885951514,"Warren Buffett buys battered UnitedHealth, sells more Apple stock. ",0.0
GOOGL,AI startup Perplexity makes bold $34.5 billion bid for Google's Chrome browser,,https://news.google.com/read/CBMiygFBVV95cUxNZVVDa1l6TXlOQ1F6Nkw0WkF3UFNFRWhGWTBwMFg1c3Z2VFVoeW5uVGkzVzZwZnF5dkRWeHRidEptQW9VMm91d3BGckpJU0JuT3dFVnRfZEdoYjFGZENaNGc3LXpRZEJ6R1ZNTjUyYXNxVDdsVzNKX2xqU3ByVTI0LUJ6M3JwTjdwQ2ZSZW5OMkVkSjJGYnVRaUJVbVMyelB6cVRNWlV1SnFkR2tlNVN0SDA4S3RkeXVCMzhjRnd1STI5dTljN1JVWmxB?hl=en-PK&gl=PK&ceid=PK%3Aen,2025-08-13 22:05:18.091420,2025-08-13,2025-08-13,201.9600067138672,-0.0067866118268749,0.010733862408600093,AI startup Perplexity makes bold $34.5 billion bid for Google's Chrome browser. ,0.0
GOOGL,3 No-Brainer AI Stocks to Buy Right Now,,https://news.google.com/read/CBMid0FVX3lxTE1FWHR5SzZNUllsZGlQOEt6dzRpS3ZWRGQzWGo3ZzM5ZFYxMHFYQ0xXMTNKRVFicVFYVjZJc0dOZ0NLMy15ZFJUdlZ5aWQzZHotTXViMVRTQXUzVHV6RHdOX3p1aFVDVEt6cTRzcVQ0Z0ZpWjZKVTlF?hl=en-PK&gl=PK&ceid=PK%3Aen,2025-08-13 22:05:18.091420,2025-08-13,2025-08-13,201.9600067138672,-0.0067866118268749,0.010733862408600093,3 No-Brainer AI Stocks to Buy Right Now. ,0.0
MSFT,IRON Financial LLC Sells 49 Shares of Microsoft Corporation (NASDAQ:MSFT),,https://news.google.com/read/CBMitgFBVV95cUxQLWwwa2w4T2FKQXpHdzlRN2ltd3IyX1g3S2s4VUFoN3o2LW95ckZXd090bTNBRGVVZGV4aFpCUzRKd1BLNHpBb3dZcUlZNzd4X0t0bnBPbE95dzBIMHI2bEQ2Q09ycVN0OGZ5Y3JDYUFYRzMxR2ItSUtyLXkyLUl1RnVqR0M1V0NkWnpFc2RQbGx6Y0JTN2ZZTl9IWl9LLU51MXpXeEdJVE9RX21raDVHODdhbENmdw?hl=en-PK&gl=PK&ceid=PK%3Aen,2025-08-13 22:05:14.757486,2025-08-13,2025-08-13,519.7256469726562,-0.016363020350273483,0.010579986445950568,IRON Financial LLC Sells 49 Shares of Microsoft Corporation (NASDAQ:MSFT). ,0.0
MSFT,A Look Back at Automation Software Stocks’ Q2 Earnings: Microsoft (NASDAQ:MSFT) Vs The Rest Of The Pack,,https://news.google.com/read/CBMiigFBVV95cUxQTFZwMDZVTDZ1VWtpaTN6VU5sbXdsb01FdUdTWkhTRjRFdkcxLXIyNnZRaUNhT0hNUU1KTUMySjZ2Z2Q0Q3N5ZWo3d1d3XzBvLTQyNXZ3WmNuTlJhQzRscXdfaDdoRzBKWktEdGJPVTI2bmZLa2tnTEE3YlBLNHpRTGVEdUVPZVItVGc?hl=en-PK&gl=PK&ceid=PK%3Aen,2025-08-13 22:05:14.755481,2025-08-13,2025-08-13,519.7256469726562,-0.016363020350273483,0.010579986445950568,A Look Back at Automation Software Stocks’ Q2 Earnings: Microsoft (NASDAQ:MSFT) Vs The Rest Of The Pack. ,0.0
AAPL,"As Elon Musk Lashes Out at Apple, How Should You Play TSLA and AAPL Stock?",,https://news.google.com/read/CBMifkFVX3lxTE4zLXctdTFyY3RjOHNFc1liRkJrdm9hbnN2WFVyZGlMNFFXZ0dNMmdVaFBRWWxvbUZMY1hKZUVkYnlrWldQVzI4WXg1NDNkM3BJODJUNU51QUhfckVZdE4ySWRfU0FIeVg2TVZVc09hYXZ3UVBoZFhacEl1Y1dYdw?hl=en-PK&gl=PK&ceid=PK%3Aen,2025-08-13 22:05:11.339568,2025-08-13,2025-08-13,233.3300018310547,0.01602441991019199,0.022304935698461908,"As Elon Musk Lashes Out at Apple, How Should You Play TSLA and AAPL Stock?. ",0.0
AAPL,"Apple Stock Is Gaining Momentum, Is AAPL Stock a Buy?",,https://news.google.com/read/CBMihgFBVV95cUxOeEY4X0h4dDN6SldSTmgtZ192RVlPWXdnN3dxSktYQXFVa3ZidVFIcjlPZ1QzdW9KaWlLQ240NmU5NTlKclM2Z3dUYVFlV2FIV28yRTBWaFlVU29MRkdKTTk5eWRJY0FpUWp0T2puOF92bWRIeGd0RzJJeUNXUzh2OFBKYXRpZw?hl=en-PK&gl=PK&ceid=PK%3Aen,2025-08-13 22:05:11.339568,2025-08-13,2025-08-13,233.3300018310547,0.01602441991019199,0.022304935698461908,"Apple Stock Is Gaining Momentum, Is AAPL Stock a Buy?. ",0.0
GOOGL,This Artificial Intelligence (AI) Stock Could Be the Nvidia of Quantum Computing,,https://news.google.com/read/CBMijAFBVV95cUxQb1k5WVpqcDRxeGowekVtbWx3elVaSm5qMjFrbVFnODhTVHRJMWwwR1ZLZEg5LS11ZHJqYzBOMXVVQmM3bGhTNm5pRVhkd0k5c2dKOWxIeHpXS1REWFd5VzRJRnlwQjVIb3FreEZQMWhSVXh3dkNGWDlmamJZWFJTTUFncnhiQ1lZcHptOA?hl=en-PK&gl=PK&ceid=PK%3Aen,2025-08-12 22:05:27.675590,2025-08-12,2025-08-12,203.33999633789062,0.011641772825326413,0.013111589314688617,This Artificial Intelligence (AI) Stock Could Be the Nvidia of Quantum Computing. ,0.0
MSFT,Barclays Raises PT on Microsoft Corporation (MSFT) to $625; Maintains ‘Overweight’ Rating,,https://news.google.com/read/CBMijwFBVV95cUxOUlB4VVZYTWlqSTNLMjc2T2RfLWZ5OUl5QlowY2YxUTU1Sl9sYmxvamVmaVc3cDd6N2poUldfVEhVeHRpWkZnN2J5dDQ5Q1lOWGd3UzBQdFlCXzZWbUxBZlBEMFhzWEF5M2hfcGRhZXM5WUFUYllHMzhZRzVqbk1NUFBqWmkwemt3YmYyOEZyUQ?hl=en-PK&gl=PK&ceid=PK%3Aen,2025-08-12 22:05:24.272727,2025-08-12,2025-08-12,528.3713989257812,0.014316580058936212,0.01281835836178979,Barclays Raises PT on Microsoft Corporation (MSFT) to $625; Maintains ‘Overweight’ Rating. ,0.9274190068244934
AAPL,"Apple Rises 9% in a Month: Buy, Sell or Hold the AAPL Stock?",,https://news.google.com/read/CBMieEFVX3lxTE92X2NNZzBNeC1Zb2p0aHdfY2lZME5aUmk5eDZVQUZpZ0lQOGpwUC1idUhjOXNkbjFDMWwybkxmQmlDMjdHdlU3SllneDRfNHhlbEV2NG83M3JIUi1yQ2tGUHU4Zjhzd0FjMkdfMEhleDY4dU5LSW5KLQ?hl=en-PK&gl=PK&ceid=PK%3Aen,2025-08-12 22:05:21.473472,2025-08-12,2025-08-12,229.64999389648438,0.010872441677679756,0.02304818167995944,"Apple Rises 9% in a Month: Buy, Sell or Hold the AAPL Stock?. ",0.0
AAPL,"AST Space, Celanese, Elon Musk threatens Apple: Trending Tickers",,https://news.google.com/read/CBMigAFBVV95cUxPWnVBazc0dWl3MVhnWnMteC1jdlh3TDl3eUFBU2xZdm1zSFpVLVlqT2gxSnVudWljQ0hQUEdYazBZZmZtcDdBdDIyUGxleE5IcGZndjJGVUF0YVpWYmZFdTk1Z1NYSzdBZVRodG9sS0tFNG1XWHd5OWlyMTYtTlkwWA?hl=en-PK&gl=PK&ceid=PK%3Aen,2025-08-12 22:05:21.473472,2025-08-12,2025-08-12,229.64999389648438,0.010872441677679756,0.02304818167995944,"AST Space, Celanese, Elon Musk threatens Apple: Trending Tickers. ",0.0
GOOGL,Raymond James Raises PT on Alphabet Inc. (GOOGL); Maintains ‘Outperform’ Rating,,https://news.google.com/read/CBMihAFBVV95cUxNUlVkbmZHTGxDaXB3RjZOOXdQLWd1T2dCV09Ibm4wZGNBb011Z1RUaGoxREZtS2xSeG1oTVdDd3lMNTlMN2hZTkRhWjAzdWJjTUFvaGd0aDVrRE0ya1VCVENZa29VYVRyNHhBV3RoLWdCczdPMC16Z01sN3dDUjhCaWc3elA?hl=en-PK&gl=PK&ceid=PK%3Aen,2025-08-11 22:05:36.191621,2025-08-11,2025-08-11,201.0,-0.0020851860429123015,0.01609087241989107,Raymond James Raises PT on Alphabet Inc. (GOOGL); Maintains ‘Outperform’ Rating. ,0.8388651013374329
GOOGL,Here is What to Know Beyond Why Alphabet Inc. (GOOGL) is a Trending Stock,,https://news.google.com/read/CBMif0FVX3lxTFA1VzA2REVLRHJuSGVfV09GbjJzWDNxeU16bzJ1OHVGekFCdTZpVnRNMWNndUUycU9TMjgzejhMQjNsU1lZYmtsYnVTdE1kNko2ejNaaDhMUVFOUjhUNFc0TXJvM0M0MWdPdk45TWY0U0lPT1I1NlNVYVJZUjRiLVU?hl=en-PK&gl=PK&ceid=PK%3Aen,2025-08-11 22:05:36.191621,2025-08-11,2025-08-11,201.0,-0.0020851860429123015,0.01609087241989107,Here is What to Know Beyond Why Alphabet Inc. (GOOGL) is a Trending Stock. ,0.0
GOOGL,Alphabet Inc.’s (GOOGL) CapitalG and NVIDIA Corporation in Talks to Invest in Vast Data,,https://news.google.com/read/CBMihwFBVV95cUxOMFV4MDFBWDNUellzTmNFbDF0bGJFa3ZrTlNvQWhBQl9oenNITjdoZzB6TDRGQWh4VVRzcVdsbUI4NnN1c2M4MXZaWFhDWGt2R3BkMjVsZlBISF9SN1BGM2FzellqeVhhQnVDQ2JmQ2VPMmZlczVFVEZvckZhdnNZUV9MRnhGMmc?hl=en-PK&gl=PK&ceid=PK%3Aen,2025-08-11 22:05:36.191621,2025-08-11,2025-08-11,201.0,-0.0020851860429123015,0.01609087241989107,Alphabet Inc.’s (GOOGL) CapitalG and NVIDIA Corporation in Talks to Invest in Vast Data. ,0.0
GOOGL,Alphabet: Why I Think The Stock Is Undervalued,,https://news.google.com/read/CBMivwFBVV95cUxOMTJ1dmVzLVFpejQySDZqUXNTTF9WX05ZMkdkWUUyckhuRlhVLWx4RVhDekxSOG5BRTQwbjBhbkt3SmRLVWkxYjAtODFSSmo0ajlxVHFhc1lXTi1CY3c0TDRZYXMxTXlUd3l6LVg5ejRqRmRibzAyNVg2MDd1eUJ4cDlPSE5sSl9aU2VrWmd4UVNPb2hpTWpFYW01eEItT2ppZVU1UWwwUHdKYXFyY3pEd29md0U4cVlVRXJWeE1jdw?hl=en-PK&gl=PK&ceid=PK%3Aen,2025-08-11 22:05:36.191621,2025-08-11,2025-08-11,201.0,-0.0020851860429123015,0.01609087241989107,Alphabet: Why I Think The Stock Is Undervalued. ,0.0
MSFT,Alibaba vs. Microsoft: Which Cloud Stock to Buy on Better AI Upside?,,https://news.google.com/read/CBMihAFBVV95cUxQZllUYXVrZWZLVmNONHVNUDhkVGhNQ3ZYazFJdWNjdUxWV0FIc2JFQTdJdkpJMVRQUU5kYWFnY2hWZDcwbHBRa3ZGTzgzdGR2c05CdzYwSUNvdDM2d3ZkZmVwdDJkdWdGcnp3aThXRmkzX1h3TTUtMmhPVFBHQk5PZXNpQzU?hl=en-PK&gl=PK&ceid=PK%3Aen,2025-08-11 22:05:33.953888,2025-08-11,2025-08-11,520.9136962890625,-0.0005171525785138131,0.01315618901771368,Alibaba vs. Microsoft: Which Cloud Stock to Buy on Better AI Upside?. ,0.0
MSFT,Microsoft Corporation (MSFT) Integrating GPT-5 Into Its Products and Services,,https://news.google.com/read/CBMikgFBVV95cUxNT242Z2VVMDhXVkZvT2tmc0NOelprMUxOcnllUUtURmFOSUc0OVZDLUZsaVl2bjI3VTV6YnhKVUw4WFVpSUpCVi1fY3pCb1RmTnJjVWhUZ2tXQWdmZ3dQZWlUTk9oUHR6ZDdWZUFzUG4zNm1faFg0TDloT0VSMHJHTlh1MXpLamJkcEhlcXA3S0xGZw?hl=en-PK&gl=PK&ceid=PK%3Aen,2025-08-11 22:05:33.953888,2025-08-11,2025-08-11,520.9136962890625,-0.0005171525785138131,0.01315618901771368,Microsoft Corporation (MSFT) Integrating GPT-5 Into Its Products and Services. ,0.0
AAPL,Apple Inc (AAPL) Increases its Total Investment to $600 billion to Expand its Manufacturing in the United States,,https://news.google.com/read/CBMiggFBVV95cUxPVUh1blVHdUlkM1MzaEpvUEstRl9KTkhvY1p6NHNmTEhWTm5Wdm4yVGQ5c2NMUWhNVVNCRW9pampJdndmY3JILVVua1VvWXF5RE5INEFMSmxGc0Jrc05HZVM4eHJBSzBZR0xRUUxtaG9maFRCZGlXd1U4T2RuN1JJd3VR?hl=en-PK&gl=PK&ceid=PK%3Aen,2025-08-11 22:05:31.144917,2025-08-11,2025-08-11,227.17999267578125,-0.008337416841468825,0.028418699903104683,Apple Inc (AAPL) Increases its Total Investment to $600 billion to Expand its Manufacturing in the United States. ,0.9451155066490173
GOOGL,"Alphabet Rises 11% in a Month: Buy, Sell or Hold the GOOGL Stock?",,https://news.google.com/read/CBMifkFVX3lxTFBreEFqWGlEVW9oNG9ESGFaQjdfaXl6UE5IbWdCMnNpYVphdTFUWUI0UWpuM0lkaWtkaDd4UEh3WWNHOGt6UlkwdFphQWVTcmJIYnZsbzlFQnF6MEdxSlMzelM5TUg3ZWpwQ2RqWTFNU25uVklFZXdqTDRWMFNrQQ?hl=en-PK&gl=PK&ceid=PK%3Aen,2025-08-08 22:06:04.724592,2025-08-08,2025-08-08,201.4199981689453,0.024933817372051692,0.019698564823787953,"Alphabet Rises 11% in a Month: Buy, Sell or Hold the GOOGL Stock?. ",0.0
MSFT,Deutsche Bank Reiterates Buy on Microsoft (MSFT)—AI Driving Double-Digit Efficiency Gains,,https://news.google.com/read/CBMijAFBVV95cUxOSDBoajExZnRQTEF3b3hheHBwTkxuT1J4TmRDclRDSldOdWt1SjBPNldnU1N0NTZtY2tMQThQc28tREVnWk9KZm5lVWVfZmE1MEZlUWpyZUtucVF4TDJXR3hMUTVvaDJ4RS1JREJLYWlIOVprM0Q1S0hLY3Ytc0ZhV2FQMHJ0REhFSjhhVw?hl=en-PK&gl=PK&ceid=PK%3Aen,2025-08-08 22:06:01.866059,2025-08-08,2025-08-08,521.1832275390625,0.002303907839930286,0.020879555594547402,Deutsche Bank Reiterates Buy on Microsoft (MSFT)—AI Driving Double-Digit Efficiency Gains. ,0.9509645104408264
MSFT,Microsoft (MSFT) Gets $650 Target as OpenAI Ties Boost Azure’s AI Lead,,https://news.google.com/read/CBMiggFBVV95cUxOTWhlMHZVWEtpcGw2V2tLa2tzVkFmMGJWSmp6b3NaVzBTREhEd0N0Y2FUTXc5RkI5T1EyNjNqN0tOaWk0ejk2bDZfc1Y3UTdRN0JtM254blNjVi1fbGRjdGpmVUhLZVIzWUhiMVJUVC1RaXY3WUZ3eU8yeXFTdGdMV0FB?hl=en-PK&gl=PK&ceid=PK%3Aen,2025-08-08 22:06:01.866059,2025-08-08,2025-08-08,521.1832275390625,0.002303907839930286,0.020879555594547402,Microsoft (MSFT) Gets $650 Target as OpenAI Ties Boost Azure’s AI Lead. ,0.9378461241722107
MSFT,Microsoft (NASDAQ: MSFT) Stock Price Prediction and Forecast 2025-2030 (Aug 2025),,https://news.google.com/read/CBMikgFBVV95cUxNMWhIRGtzNWpqTTFCaWEzWndHOHpkNG5BbVlnNU1Ta3pSNEpsUWprX3RtVXlzc19Uak5EYWROSV9rd1o3TjdQS016SFcyWDhuX0RfSFlxV1JLTFJYWEdwUThHd1dzbnRlNEdIbm5MYWhlUlRMNklaQlhoaFVQWngxUTRieTVteWNaZjZ3aVMxWHY3QQ?hl=en-PK&gl=PK&ceid=PK%3Aen,2025-08-08 22:06:01.864049,2025-08-08,2025-08-08,521.1832275390625,0.002303907839930286,0.020879555594547402,Microsoft (NASDAQ: MSFT) Stock Price Prediction and Forecast 2025-2030 (Aug 2025). ,0.0
MSFT,Microsoft's Impressive Free Cash Flow - MSFT Stock Could Be Worth 28% More,,https://news.google.com/read/CBMi4AFBVV95cUxPUnM0MWxHNzh4WmpnLUlQWnVqZTZqMXlTUjM5UnlqemhpNHlRTjN6VklTOXQybTdWcWFndy1qVkNiWkpGLVY0OEp4a0lHaGgwaTNQeUUxM0xXS3hWeXFiekhSLUhYbk5IZHg2U0hCTGRZY1VSNkQyWHN3Y2FTQlZSR1dCWWNGT1hyb0lRdHdqU1NGQWRfOHhxS2dxdzMzSkk4TjlSUWxjVTdob1hXeTZVS1RxZGEycHJzZGtrb1dkNWdWVy1BU0lHTXJFWXl6LXFQTGZsR0VvQU5fZ2liRWtLUw?hl=en-PK&gl=PK&ceid=PK%3Aen,2025-08-08 22:06:01.864049,2025-08-08,2025-08-08,521.1832275390625,0.002303907839930286,0.020879555594547402,Microsoft's Impressive Free Cash Flow - MSFT Stock Could Be Worth 28% More. ,0.7214677333831787
MSFT,Microsoft Stock Heads for the Clouds After Q4 Earnings. Is It Too Late to Buy MSFT Here?,,https://news.google.com/read/CBMigwFBVV95cUxPYVpqLXJYQVljOEVLb0FQbEh5bnRUVGM5UmNsWHNBQm1iMWRvV0dxa0pjZGR1QW1Bd0VmUUZhU2lYX21MS19hYXoxYldHSDA0TWFORnJHTlkxdXRkWXFEZVJhY01IS0ltWHNFbUFxRDJFU1QxV05Xa3luNG1rVF9FdnJxYw?hl=en-PK&gl=PK&ceid=PK%3Aen,2025-08-08 22:06:01.862040,2025-08-08,2025-08-08,521.1832275390625,0.002303907839930286,0.020879555594547402,Microsoft Stock Heads for the Clouds After Q4 Earnings. Is It Too Late to Buy MSFT Here?. ,0.0
AAPL,Is Apple Stock a Buy After Appeasing President Trump?,,https://news.google.com/read/CBMiiAFBVV95cUxQZHBEQ0ZSVGhocWZsNW04SGxCLUFleVl1RGZOMDhNNFV1aWtNWnlPQ1JVRFlfb1hzWUFuZUtVaGF6RVZ3NklVSUtTNHYyRmVqQ0hCOGlicTZwZFZ3VHFwV3BjVC1IMHRBb1Q0Q0FjQjBicUI2allkcHF1bHNfZ293NjdFLTVnX2Z6?hl=en-PK&gl=PK&ceid=PK%3Aen,2025-08-08 22:05:58.476893,2025-08-08,2025-08-08,229.0900115966797,0.04235792328538146,0.02826126498467869,Is Apple Stock a Buy After Appeasing President Trump?. ,0.0
AAPL,Why Apple (AAPL) Stock Is Moving Upwards,,https://news.google.com/read/CBMifkFVX3lxTE1lRElRLTFBQXlkVkZTSDdFZkpaNHlMLXJlaFIzMWNacEFneXMwTUlSMWppU2xNT29JbzBRUEk5aTdqdnhwNHBIZU0xaklqTXVod2xsRmNPVE5IQjNnZkM1Uk1xZFhLSlBxSUFIQUtxdHV2WVg4SjBIVE9ISnR3dw?hl=en-PK&gl=PK&ceid=PK%3Aen,2025-08-08 22:05:58.476893,2025-08-08,2025-08-08,229.0900115966797,0.04235792328538146,0.02826126498467869,Why Apple (AAPL) Stock Is Moving Upwards. ,0.0
AAPL,How Apple's 'made-in-America' strategy led to big market gains,,https://news.google.com/read/CBMihgFBVV95cUxNTWZvcHRENGdFbVR6VEp0VkdXOHZRLVk5aURnbXZubEVFa3VIeVg1cTl3eTVnM2FoR2dZWlBrUjhGM094dmQxTjBnaG1HdVN6VmVXY2FZdHpTLUpYZUdBbVhnVVJhLWJzek1nOGNWWEl3YURZQ2lhSjBGcnRzYjFtM0hhMEEwZw?hl=en-PK&gl=PK&ceid=PK%3Aen,2025-08-08 22:05:58.476893,2025-08-08,2025-08-08,229.0900115966797,0.04235792328538146,0.02826126498467869,How Apple's 'made-in-America' strategy led to big market gains. ,0.6682723760604858
AAPL,Apple's $704 Billion Decade-Long Buybacks Exceed Market Cap Of All But 13 Companies Worldwide,,https://news.google.com/read/CBMiggFBVV95cUxNNWhhdFRwNmRJRGVBOGh3dGN2QzlRejc4bi1kX3haVHBUeDJpRE1OODVsbEdVakxKcHQ1S19GNlJ6amgtM2tXRzVDb2d5bDU3Ri0tM2dOc2k5eFdpU3NtYXByZTBNRWFIdHk3WEpzMHVQdkw4bnZndkNZc0RMOXVIeEpR?hl=en-PK&gl=PK&ceid=PK%3Aen,2025-08-08 22:05:58.476893,2025-08-08,2025-08-08,229.0900115966797,0.04235792328538146,0.02826126498467869,Apple's $704 Billion Decade-Long Buybacks Exceed Market Cap Of All But 13 Companies Worldwide. ,0.6563851237297058
GOOGL,Google Is Ditching CrowdStrike Stock. Should You?,,https://news.google.com/read/CBMihgFBVV95cUxPM3ZzZFN6MWZ0a2JoSE5xTUE2bkx3dDlnR0lxck1RMjFMN3FBcEhqbGM4V3RRSzF5UmVXVUlPVDVQZ3g0VWVIYXZnQXRETmtsR1dGT0JJbGVxRUR2UV82dHhjbVBPcWNmcVdJV2c4Y1BMNlZyc19jQmpLdFVlb01NaTRWX1F1QQ?hl=en-PK&gl=PK&ceid=PK%3Aen,2025-08-07 22:06:14.277377,2025-08-07,2025-08-07,196.52000427246094,0.0021929111255085676,0.01738767596764333,Google Is Ditching CrowdStrike Stock. Should You?. ,-0.5238503813743591
GOOGL,Great News for Alphabet Stock Investors,,https://news.google.com/read/CBMiigFBVV95cUxQMmNhaENod19qbk42dkpwMDJXQkFzbHluODlqV1ZwRUh2clVTc0pheVNjNmVpWk8xS1RzbXRaQ2o1MmhyOFNGNFFvUjgwSWg3bVhOLWxrYXlIV3NuMmE2QjlURHUyS293OUtTaFBqclhFaUl4aEduNEUzVTU3eXlpdHdVU2hfOHMyN0E?hl=en-PK&gl=PK&ceid=PK%3Aen,2025-08-07 22:06:14.277377,2025-08-07,2025-08-07,196.52000427246094,0.0021929111255085676,0.01738767596764333,Great News for Alphabet Stock Investors. ,0.5052976012229919
GOOGL,Democrats ask Google whether talks with Trump over censorship suit include possible 'quid-pro-quo' deal,,https://news.google.com/read/CBMiekFVX3lxTE4xc3BIZlRmckZTTmxYREpKWlRmd2Y2VklQMG50VTEwWVF6bkYyWTdJcWxMcFlPZDBFUHR1dHJOUmJfS282UzJqclZ3YWRUSDBGTm1XTTR0bU9wNnB0d0pZRWlqeU5oLXl4WFBEQVRNckhXSVBhdzlVMWVB0gF_QVVfeXFMTkxqZW5xeFVMdUltNVI3WFhKRjJWaDBRWS1Wcm5lWjFsVmcxcEtXSTJEWDN5WGRPV1pRZUhUQXotdEFKdmp5UktnS3ZnU1JrMEZ1MmotbVhvR3JXMTNlU19tbGZkcjFRTkJ3dERfYVVZQmY3MGkwdUp2NHdVWllvMA?hl=en-PK&gl=PK&ceid=PK%3Aen,2025-08-07 22:06:14.277377,2025-08-07,2025-08-07,196.52000427246094,0.0021929111255085676,0.01738767596764333,Democrats ask Google whether talks with Trump over censorship suit include possible 'quid-pro-quo' deal. ,0.0
MSFT,MSFT Q4 Earnings Beat on Cloud & AI Strength: Time to Buy the Stock?,,https://news.google.com/read/CBMifkFVX3lxTFB6aDZlcEdtNVVENFBrY3RkV0RORjFNczVMeUIxVWlnM1hjVHJqYTI3WXJiOUNleUZxYlZjTzZZY2QyT0xQQUpFRS10WFpjWDU5bFRKRHZfV0hjSl9vLUdfS3dQSldQNkNubS1xT1NDVkpyUkpQYlR1Zk0zQzFOdw?hl=en-PK&gl=PK&ceid=PK%3Aen,2025-08-07 22:06:10.912904,2025-08-07,2025-08-07,519.9852294921875,-0.007810398227357296,0.020885437396093325,MSFT Q4 Earnings Beat on Cloud & AI Strength: Time to Buy the Stock?. ,0.0
