ticker,headline,summary,link,scraped_at,date,Date,Close,daily_return,volatility,text_for_sentiment,sentiment_score
MSFT,Wall Street Bulls Look Optimistic About Microsoft (MSFT): Should You Buy?,,https://news.google.com/read/CBMihgFBVV95cUxQSGpyT1lkU1habEIwWmZVWWtOTTRrb195QklGaHNRT3lUS1JoSlJ1TzRyc2wwTlVrMzJVdF9pMFh0RXV4UVVYYWo1VVBFRXlpVHNNOVNTMk1YYktJa21OS0pNclp0RlZSOFoxX1dKbW1ONWtUYWtSUEtoWVNoczE1WUNXYXdVQQ?hl=en-PK&gl=PK&ceid=PK%3Aen,2025-06-23 00:00:00.000000,2025-06-23,2025-06-23,485.2023620605469,0.01801422469496128,0.009922961354957596,Wall Street Bulls Look Optimistic About Microsoft (MSFT): Should You Buy?. ,0.0
MSFT,How Is Gen Digital's Stock Performance Compared to Other Software - Infrastructure Stocks?,,https://news.google.com/read/CBMijgFBVV95cUxPNTFlN2lDa29xWTZFbV9wd1ZnanZjLW1iTUlIeVAxT0l5NUt0VWVjMXFBLXNnWFVibGJwd3NHajkzVDczRWNEWjBhX1ktZVRENUxPUU1qb2R6STBOWUo5ZWxPSmx1Nlh6LThyOWJiZFppR3BZcUdxcXNrbnRwRWJYazBUMkNYMkJpQWRLcEpR?hl=en-PK&gl=PK&ceid=PK%3Aen,2025-06-23 00:00:00.000000,2025-06-23,2025-06-23,485.2023620605469,0.01801422469496128,0.009922961354957596,How Is Gen Digital's Stock Performance Compared to Other Software - Infrastructure Stocks?. ,0.0
GOOGL,Alphabet Stock Is Flat… But Not For Long (NASDAQ:GOOGL),,https://news.google.com/read/CBMihwFBVV95cUxPOS1SU2dfdGdma2FjX2hMWG9VdUljaFExTlJ0UHVWWGlhUU9sVXMwSV9mQzBOYU94SjB3RTZqSVR5aWVUMloyV2F0SkMwQkwzTExRTVg2V3BvZjJReEpIN2RYTjVCUUw1ZG5QemgxUVc3RmR5RDBGVzJ5Xy1nYklzYko5OEpZS1k?hl=en-PK&gl=PK&ceid=PK%3Aen,2025-06-20 00:00:00.000000,2025-06-20,2025-06-20,166.63999938964844,-0.0385414704147482,0.015160356631916424,Alphabet Stock Is Flat… But Not For Long (NASDAQ:GOOGL). ,-0.9227060675621033
GOOGL,Why Alphabet Stock Flopped on Friday,,https://news.google.com/read/CBMihgFBVV95cUxOb1ZZVFpMM0pqOFBHNTF5NldhcUZPTVo3Y2tyOHZRenVtSkR5dGw4ZTdfUnVwcF9pejNnWEtLNk1OdWN2djB6b3ZPd2JNTlY2ZWFEbmxybm5IMDc2U05YWmJORkNoMXRxZFVaV3l4Z1dtRE04NnlEVE53T2xpd2NuZ1YyTWM0UQ?hl=en-PK&gl=PK&ceid=PK%3Aen,2025-06-20 00:00:00.000000,2025-06-20,2025-06-20,166.63999938964844,-0.0385414704147482,0.015160356631916424,Why Alphabet Stock Flopped on Friday. ,-0.6285836100578308
MSFT,What’s Happening With MSFT Stock?,,https://news.google.com/read/CBMilAFBVV95cUxNTmk3UmRXOXNYZHpuNUxBM2VfRjlKUGNvbkVOM1h6a1d4X0tQVENWdVloYjltcHNWelk2dGlTNnJ0cmpmYU1UTjlBTE1aWFRfM0pQQndmVHhDY0hjUDA2Q0pEZ3l2YU9XdDNHYWxYbFFMLXpMbTR6LXktVVRLSTZwRm1BcGhSYmZ2R1pySEVlMlBBZmpr?hl=en-PK&gl=PK&ceid=PK%3Aen,2025-06-20 00:00:00.000000,2025-06-20,2025-06-20,476.6164855957031,-0.005913685323681417,0.0078102685319272995,What’s Happening With MSFT Stock?. ,-0.515886664390564
GOOGL,Earnings Growth & Price Strength Make Alphabet (GOOGL) a Stock to Watch,,https://news.google.com/read/CBMijgFBVV95cUxNVGtvcjF3VlpxcWQ3LURqVXZjd2RRdFhsdjhBU2l0U0Jkb0YxY3BNUjBQRzFEUDNSMk8tWGw1TDVveFE0N3QwRGpsZy12S09lSlhhVEhGUGVBang4Z2xYVW4wYlNLcjNFVXRHcFpfZ1ZaVWVqV2xlNTNBaldxUndYczBHMlhQMGViLXdzOTZ3?hl=en-PK&gl=PK&ceid=PK%3Aen,2025-06-20 00:00:00.000000,2025-06-20,2025-06-20,166.63999938964844,-0.0385414704147482,0.015160356631916424,Earnings Growth & Price Strength Make Alphabet (GOOGL) a Stock to Watch. ,0.514454185962677
MSFT,"Wells Fargo Raises PT on Microsoft (MSFT), Keeps Overweight",,https://news.google.com/read/CBMigwFBVV95cUxOSGppYmg1Z29jY0lndElhMmRYSEd2ZVFYcE9BdURhS2JhUmhRRWpDNFNlX2FYNmZEbmdMYVFldEpHRGJWcFh0RmpSQTc5N1pZdE9JZFFkQW03MkJkM2RqUHBfRzRqcWxvano3ZVN3em9FZjZBNjl3MTloLUI2N1RseWNnaw?hl=en-PK&gl=PK&ceid=PK%3Aen,2025-06-20 00:00:00.000000,2025-06-20,2025-06-20,476.6164855957031,-0.005913685323681417,0.0078102685319272995,"Wells Fargo Raises PT on Microsoft (MSFT), Keeps Overweight. ",0.7243434190750122
GOOGL,Here's Why Alphabet (GOOGL) is a Strong Growth Stock,,https://news.google.com/read/CBMigwFBVV95cUxQRzRlZUR0SkFsUXFuZHp0VVROQl84cVhHZ1FMNmo0MGczUVFrS0l3WmVSemJDZGp6UGhVejVsVHdqOEo5VjRSNnczRlJSSk5nQkN0X0VSUmJCdVhRVUNuQmRmN0J0RFJKcld4MEpKNkpDV3ZDOXFMYzNMZ0ZaTnNZbWhQYw?hl=en-PK&gl=PK&ceid=PK%3Aen,2025-06-18 00:00:00.000000,2025-06-18,2025-06-18,173.32000732421875,-0.014947369534749622,0.011017940871816925,Here's Why Alphabet (GOOGL) is a Strong Growth Stock. ,0.0
GOOGL,"Amazon's Zoox, Alphabet's Waymo in NYC, Oracle stock pops",,https://news.google.com/read/CBMihgFBVV95cUxQN25SZG5MRHU5YW5KUmljYmZaM2QxSV95cFdPTWdiZ1ZwY2ZNR2hqdjBBWHNQQklaZUpZODEyUklwWHBFeWpTMGpQa3NacU9rNkRsMDNpcklQQl9PVlE1a2diZXZOUllCZjVuZ0huNkVXRmNlbDhlSGtRdnpHaXJCN25rekpxQQ?hl=en-PK&gl=PK&ceid=PK%3Aen,2025-06-18 00:00:00.000000,2025-06-18,2025-06-18,173.32000732421875,-0.014947369534749622,0.011017940871816925,"Amazon's Zoox, Alphabet's Waymo in NYC, Oracle stock pops. ",0.0
AAPL,Apple Facing Tough Pricing Decisions (NASDAQ:AAPL),,https://news.google.com/read/CBMigwFBVV95cUxOQ0ZfVnh4MllVRmw0cjFJZ2F0TGZ3cXZuaEdXOHpxWDEtbkRmdUc1MVdwS2hMUW1IR0JCUVpLYlgtSjZkdkhVQVZBSjN6SlRjR3U2M0hsWjFHRWYxbWRvU1RWemNoTDF1M2pIcmxXQmtKZ0xTSjFrU1NqeWhNeWJmSlFJRQ?hl=en-PK&gl=PK&ceid=PK%3Aen,2025-06-17 00:00:00.000000,2025-06-17,2025-06-17,195.418212890625,-0.014010719296581597,0.011578952983170018,Apple Facing Tough Pricing Decisions (NASDAQ:AAPL). ,-0.8577518463134766
MSFT,"Microsoft Corporation (MSFT)’s CFO “Told A Great Story,” Says Jim Cramer",,https://news.google.com/read/CBMiiAFBVV95cUxQd0VfMWE3YnlOQlRqTkduX3c1aWpOOHZaeG50dlpWTF9pb2paWnpXLVY3Yk9VLXVyNEFKbFQxaHFZdGtZcUxPYktBMmg1ZllsOTdrZTdYQzNOMUxnNmVueWxyVmVtTVh5bEFkcHREQ0FaN181b3ROVWpOUnF4RnRLYThfZS1mVWct?hl=en-PK&gl=PK&ceid=PK%3Aen,2025-06-17 00:00:00.000000,2025-06-17,2025-06-17,477.25543212890625,-0.0022958026862665015,0.007522461473912462,"Microsoft Corporation (MSFT)’s CFO “Told A Great Story,” Says Jim Cramer. ",0.8971683979034424
GOOGL,Why Alphabet Inc. (GOOG) Outpaced the Stock Market Today,,https://news.google.com/read/CBMiggFBVV95cUxQNDByRVJROEJURTBoN19pRDdFeHJ5QnNsSGw3MndZUkZDbTQxbkVla003TkhKeHZKbFlnM0ljV010a0RtXzUxSDhDMTNuRFFPanVPZ096b1NkR1dpWW1zdWhhX2pCc3pwdl9zSG12RWFkRGJXRFV2THEtVkRxdFMwX1lR?hl=en-PK&gl=PK&ceid=PK%3Aen,2025-06-16 00:00:00.000000,2025-06-16,2025-06-16,176.77000427246094,0.01202270639222447,0.015388696703899694,Why Alphabet Inc. (GOOG) Outpaced the Stock Market Today. ,0.8709359765052795
GOOGL,Donald Trump Stocks: 8 Stocks Owned by the President,,https://news.google.com/read/CBMifEFVX3lxTE1OM0theVZwbDJHb2Y5M2txNkxtajIwaVFMNk55ZlRuWjR0cnVOTEwyRk9CMU9NbnpLSHRtXzc4N1VrR2ZfZkdnTDhEVzVobThVWVZaNURmTExwNGVEMzEtZmkzMS11VTVFWkFPWHBaSlNaemk3T3RzdzNTclk?hl=en-PK&gl=PK&ceid=PK%3Aen,2025-06-16 00:00:00.000000,2025-06-16,2025-06-16,176.77000427246094,0.01202270639222447,0.015388696703899694,Donald Trump Stocks: 8 Stocks Owned by the President. ,0.0
MSFT,"The Zacks Analyst Blog Highlights Microsoft, AstraZeneca and BlackRock, Taylor Devices and Geospace Technologies",,https://news.google.com/read/CBMijgFBVV95cUxQVGJ6VWFpNk1HWGtmZlpLa2t0RjUyS0tzTFpJeHlDcUoxdXNEeG02NlFaeU5zZXM4aXNOYnd5SnFBQlJ0b3R3MG1UWFZreXhOaFc4OWtWampnaGwzZHAtV0hmQnpMR2FqelpmOVBXX3FfNk1pa2piV2E1RlVUQVAybWZ4T0ZES2hBcjhFMUpR?hl=en-PK&gl=PK&ceid=PK%3Aen,2025-06-13 00:00:00.000000,2025-06-13,2025-06-13,474.18048095703125,-0.008165080510427192,0.007241809102306508,"The Zacks Analyst Blog Highlights Microsoft, AstraZeneca and BlackRock, Taylor Devices and Geospace Technologies. ",0.0
AAPL,Saylor says Bitcoin could fix Apple’s stock buybacks: Finance Redefined,,https://news.google.com/read/CBMizwFBVV95cUxOOFRSbE9rbFFGR2VNSVdNUDJVLXhLNnlfaDd2WVVpYzhqdWpmTExtVWdXSXp1eHhUUDNzdFIxS0pMaXVUWlNNZkpkTThkZ2tRczNYb0N2MzJGNjBSVHhtcjhZMXVGZ1pidHZMSXplV05mSmw2RkxDXzFLYXh6dE5wWjdDZHp0a1hvV3B3cjV3bUttZTJwMm9nNWFwbFg1TmdWY1RkaEZ4MGJoWV9qeHQ0UTRrNGFnb3Z4UDZ6TVJlUHpqUVpFODJKdTJCOXRTRFE?hl=en-PK&gl=PK&ceid=PK%3Aen,2025-06-13 00:00:00.000000,2025-06-13,2025-06-13,196.227294921875,-0.013805244367089187,0.012858212966223548,Saylor says Bitcoin could fix Apple’s stock buybacks: Finance Redefined. ,0.7078585028648376
AAPL,Can new iOS 26 software save Apple's stock? What investors should know,,https://news.google.com/read/CBMi7AFBVV95cUxOWVpQaThLMTVnQ2oyTjZrY3RZNzdmWk9zV2lyUkZiUEVhT3FIbmFKSHlPQVZNWTF5bnY1RXZzWGJhVklYODl6RnUyLU1rZUVpSzNsNE9ud25feGRxU2hOSjR6RldONnFvYlZLT0xCaWFtaUtpdWFCZWkyYjdpZnVXOGlwSzVMZEg3Umo5SjRPZ2JiS0UwcHNScDRBX2RTSjZHaVFQQ2JGT1pUd1dycDUyYTMyenB4anJYLWNQcjR6cmtNbW1DY0FNeEdZNWpXTGN1Slh1by1YX2dMTVRVNmJvdEExb05EYW1rQmNhWA?hl=en-PK&gl=PK&ceid=PK%3Aen,2025-06-12 00:00:00.000000,2025-06-12,2025-06-12,198.97418212890625,0.002112895022762018,0.012185534520691172,Can new iOS 26 software save Apple's stock? What investors should know. ,0.0
MSFT,Microsoft (MSFT) Laps the Stock Market: Here's Why,,https://news.google.com/read/CBMihAFBVV95cUxQN05LenQ4SENDSllUN0t5YjlFT2U3VDQ3V280NV9ndDVhNG5zUnE0cmRGYVRLRjcwSnpyN0VrWlVGYlg2enBkRVl5R2h6eENzQk5VTWFKejRtNGdEVE5VU0YtbmZlQU81R0NQS0FiX1RPQWltUHRBWnZ4UEp2TzJPN0VoMmI?hl=en-PK&gl=PK&ceid=PK%3Aen,2025-06-12 00:00:00.000000,2025-06-12,2025-06-12,478.0840759277344,0.01322416250280134,0.005297260764380367,Microsoft (MSFT) Laps the Stock Market: Here's Why. ,0.0
MSFT,"Top Stock Reports for Microsoft, AstraZeneca & BlackRock",,https://news.google.com/read/CBMijgFBVV95cUxPQkM5Y3o2TXBvQXF6UjZaQ0h5NkswX1dUcE14S0hFX3NEbkYtT2Y3NnR3eDYtWXRmMV9yWVp1VWwwLVMxV1l3N3pzY3pOa1RUT0hXYjZwOTN0YVRaeVppLVZ2Ylh1ZHFTYVh1NjdkcmZYOVhEcjVTeDhtVTYwZHZMb0RUZjBYN2lMTXpzaXRR?hl=en-PK&gl=PK&ceid=PK%3Aen,2025-06-12 00:00:00.000000,2025-06-12,2025-06-12,478.0840759277344,0.01322416250280134,0.005297260764380367,"Top Stock Reports for Microsoft, AstraZeneca & BlackRock. ",0.0
MSFT,"Citi Opens Positive Catalyst Watch on Microsoft (MSFT), Sees $605 Price Target on Strong Azure Outlook",,https://news.google.com/read/CBMihwFBVV95cUxORnBrdkhicnhqVlJiUk5fY01XM2hBWGlaNHh4M3VZUlJUeEc3SUowbTdiUWtaMWtJaEtaWHgtZDVkQXk1dUxCRWlLaksxaFJsSmVUNkxteU95UGJIVVZ2SHdISWh6bjFaWmw0aWNXSXBGQnBFREJtVF9jVGEyb1lBNFRBUUpMTlE?hl=en-PK&gl=PK&ceid=PK%3Aen,2025-06-12 00:00:00.000000,2025-06-12,2025-06-12,478.0840759277344,0.01322416250280134,0.005297260764380367,"Citi Opens Positive Catalyst Watch on Microsoft (MSFT), Sees $605 Price Target on Strong Azure Outlook. ",0.9405623078346252
GOOGL,Pixel Gets New Features and Android 16: Should You Hold GOOGL Stock?,,https://news.google.com/read/CBMiggFBVV95cUxNdWVuWHlZTWZHdC0tZko5RTdtX2VYbmVkLXduRnZ6N0hjSTRnUklVX0VqUjBRZjFrTkZ3ckFCeTVjS214M0NGTEI0R2VaalRSTXBoMjBMYXBIMDFRcHpKVXhjZU1YeTN0VDJsOFNWbENhSGwya0VwdjVRNXEwd25yMEx3?hl=en-PK&gl=PK&ceid=PK%3Aen,2025-06-12 00:00:00.000000,2025-06-12,2025-06-12,175.6999969482422,-0.009303688178676217,0.014576966532902254,Pixel Gets New Features and Android 16: Should You Hold GOOGL Stock?. ,0.0
GOOGL,"If I Could Invest $1,000 in Any Growth Stock, It Would Be This One",,https://news.google.com/read/CBMie0FVX3lxTFBaNFNHZVdYbHdBUWdsV3JEWTVSWkc3MTdjZXZyZ0hCc0tybWhtNmtDX1JlRzM5aXhwMDBHU1VvZDhlVXVldHZ4UW8xNk10MmV2ZW9xZWNsWGl0NVNJRVNUWGV4S2tPcnNOWDhnLTQ0bjJDY2dCU1ktNXVOdw?hl=en-PK&gl=PK&ceid=PK%3Aen,2025-06-12 00:00:00.000000,2025-06-12,2025-06-12,175.6999969482422,-0.009303688178676217,0.014576966532902254,"If I Could Invest $1,000 in Any Growth Stock, It Would Be This One. ",0.0
GOOGL,Alphabet (GOOGL) Reaffirmed as ‘Overweight’ by Morgan Stanley as Google Appoints New Chief AI Architect,,https://news.google.com/read/CBMikwFBVV95cUxNaWd6WENCYnRBQ2dnQWhSb05YSng3R1pieEVsc3FXR2tQbEpxLUxBcUdJZ2tqYmE3MG1MNUR0cG1INU5aSDZjNGZfSFkzZFdQWXZ3b1N2MEcxZFoyTGVIc1pRbmtZZ25oczFpQjBPdlF2eC1KZnFiUFZXelU0M0hWaVQ5UUoybXA5QjNBTTRRUjEzTWs?hl=en-PK&gl=PK&ceid=PK%3Aen,2025-06-12 00:00:00.000000,2025-06-12,2025-06-12,175.6999969482422,-0.009303688178676217,0.014576966532902254,Alphabet (GOOGL) Reaffirmed as ‘Overweight’ by Morgan Stanley as Google Appoints New Chief AI Architect. ,0.649779736995697
AAPL,"Apple (AAPL) Gets Buy Rating Despite AI Letdown at WWDC25, Says Goldman Sachs",,https://news.google.com/read/CBMifEFVX3lxTFBxakNmMWp5SmJuMUpGa0tYUXRHNm01Nm94RVJMREd4UUlubEZSNGxQMGJtV0pLdWEtdG9pNzVBdm1HMDdDZ3JkdW1Kd2h4RkVSbUdGVlNnbHUwZWxHdV85eHZ3bzQ5Yjlqbmtma2p6MWZHdlp2NVNaOTdjRnk?hl=en-PK&gl=PK&ceid=PK%3Aen,2025-06-11 00:00:00.000000,2025-06-11,2025-06-11,198.55465698242188,-0.019193760456297837,0.012743982334915617,"Apple (AAPL) Gets Buy Rating Despite AI Letdown at WWDC25, Says Goldman Sachs. ",0.919999897480011
AAPL,"Buy, Sell or Hold the Apple Stock Post the WWDC25 Announcements?",,https://news.google.com/read/CBMie0FVX3lxTE5MVjVoalVzUGpwak50WjBVVC1JSE0zNWtIY3N3OGJ2eFlBWHFzUFRDRmdNWjNXYkh1OVFEQ2ZqdWhJUmt4a0J3MmRDQkp5UmNnUHNmOFU2NjRtV29XM0IydjRpMmhnOWwyQVRSWjRIOGdNbUVnZzlMY2JKTQ?hl=en-PK&gl=PK&ceid=PK%3Aen,2025-06-11 00:00:00.000000,2025-06-11,2025-06-11,198.55465698242188,-0.019193760456297837,0.012743982334915617,"Buy, Sell or Hold the Apple Stock Post the WWDC25 Announcements?. ",0.0
AAPL,Jim Cramer Notes “It’s Been Hard to Own Apple Lately”,,https://news.google.com/read/CBMie0FVX3lxTE5wTUpXS3hwUUlaQTlpSm9CUmpqWnFzWXJOVGJiTzJ3TC13TzRZTUdsUTZJZlQxSldzT2pSYV9tb2ZhS3hZeEoyLXZxRi1pZ1QwaXlkaW1DYnpxWkF6NFNMei1LUE5PclJFejA5MWx1eHhHOUdVTWlBU2lIcw?hl=en-PK&gl=PK&ceid=PK%3Aen,2025-06-11 00:00:00.000000,2025-06-11,2025-06-11,198.55465698242188,-0.019193760456297837,0.012743982334915617,Jim Cramer Notes “It’s Been Hard to Own Apple Lately”. ,-0.660656213760376
MSFT,Microsoft Stock (MSFT) Shrugs Off Macro Blues and Returns to Record Highs,,https://news.google.com/read/CBMigwFBVV95cUxOQzJsV0xnYWduakkwRFJwNmtpdFM3a1hvZktYZEtQMnYxX1hKRmkxQldxYjFfRlg2T1I5b2tMb1BiSWtBM2dpRVpQSzMxeEY4R1pQaWJmU3l1R19kVDFueUpjTDM1dnFPc09wZHFSUk9jdHZyUXZ3MUdZaVJLaW13ckNXTQ?hl=en-PK&gl=PK&ceid=PK%3Aen,2025-06-10 00:00:00.000000,2025-06-10,2025-06-10,470.1471252441406,-0.003870966156736544,0.0038265488700536584,Microsoft Stock (MSFT) Shrugs Off Macro Blues and Returns to Record Highs. ,0.8211673498153687
AAPL,3 big takeaways from Apple's WWDC so far,,https://news.google.com/read/CBMif0FVX3lxTE83N3hGSks3Y3hLdU5nUllCQXZoMWdMa1VIbHZTQjR2ZnFuOGFMLS1QYmhkYy1rWHFTRFNOaTZBWTVCaGdvWFBlMFVBR3VIdm4zYnZ6d2dnVXA3aUxfaV80VVM0LXJwMUFTNVVWTG5PUkYyYlVpanVLVUpoQVFFbmc?hl=en-PK&gl=PK&ceid=PK%3Aen,2025-06-09 00:00:00.000000,2025-06-09,2025-06-09,201.2216339111328,-0.012112562253018933,0.01022411963992317,3 big takeaways from Apple's WWDC so far. ,0.7625532150268555
GOOGL,Alphabet (GOOGL) Laps the Stock Market: Here's Why,,https://news.google.com/read/CBMihAFBVV95cUxOWTRRc0FScHFoTVVOVDhTMjBKWjBSVVlYR2t4alNUY1I0eFNjYmRwdnpTVGFNN05RbGhGcnZWdmtjUjZyUFZiX1d5VzNvUXZmdDgzNy1kUXdLR1U1Wl9SSmJNdzcwcUZKZXloVVhuVjNXRGpFNE1uOExiVHBhNkVOc1lNVnI?hl=en-PK&gl=PK&ceid=PK%3Aen,2025-06-09 00:00:00.000000,2025-06-09,2025-06-09,176.08999633789062,0.0151035371418764,0.01754356900300706,Alphabet (GOOGL) Laps the Stock Market: Here's Why. ,0.0
GOOGL,Do Options Traders Know Something About Alphabet Stock We Don't?,,https://news.google.com/read/CBMijgFBVV95cUxOZDE5b2Y0QlFqSkpKRjRnOXNwa080bmh6NFdLZUVtc3U1dHhJc0VVMlVMc2FqOHZkR3BWSm5EUkVHbjJCVFFHQTRUSnB4OXVzN1JBZXpJZllSMktwNFYwSzJNVEc0bUhaTkdwY0VTTFZDdDlLZjd3eGVjd0ZPbkdTSUF0YUtDMzZ3TnJ5RFdB?hl=en-PK&gl=PK&ceid=PK%3Aen,2025-06-09 00:00:00.000000,2025-06-09,2025-06-09,176.08999633789062,0.0151035371418764,0.01754356900300706,Do Options Traders Know Something About Alphabet Stock We Don't?. ,0.0
GOOGL,Did Google Just Give Investors a Reason to Load Up on the Stock?,,https://news.google.com/read/CBMihAFBVV95cUxNYnk4dXVlSFRTR0RYU083ZUUyYjdSRUpSN1JWSWlHVlBGRk1JS0dFM3hqVE9SOXFTVkpadDdwYmRFalNVN01EZ2dNZ1l0bFNoYkMyVmw1UEljV3piR2JoRVV2SFJUcXdwOEdBOXA3NGF6QXN0cUtKRWo4V21oTzlvb0E4MlU?hl=en-PK&gl=PK&ceid=PK%3Aen,2025-06-09 00:00:00.000000,2025-06-09,2025-06-09,176.08999633789062,0.0151035371418764,0.01754356900300706,Did Google Just Give Investors a Reason to Load Up on the Stock?. ,0.0
AAPL,Apple stock dropped as WWDC got going. Here's why.,,https://news.google.com/read/CBMimAFBVV95cUxPa0tTekxmczhmekxPUml6Q1pQZlA4aDFfLVRVOHJyR1JqelkxWXFERjA2eG4wRHRNckYyZW9OZGcwY0VLd3RzY3l5WTJIZ2cydzQtNnVnOUNZU3pQREZKdW5Uc1dwRmtONWRnQzhUZVJLSWhJbzBKcHE1WTljZlJ4TmhPMUlUUUo2ejdhS0RjcWtxMTZQcXFjRQ?hl=en-PK&gl=PK&ceid=PK%3Aen,2025-06-09 00:00:00.000000,2025-06-09,2025-06-09,201.2216339111328,-0.012112562253018933,0.01022411963992317,Apple stock dropped as WWDC got going. Here's why.. ,-0.8033638596534729
MSFT,Jim Cramer Calls Microsoft’s (MSFT) Latest Quarter a “Great One”,,https://news.google.com/read/CBMigwFBVV95cUxOSmJuNjlMS1FzenBRQmdDU1VuVHJsckRSNk9tTHFWakFnOTFyQmFHb3BqME93dWRtVVZFMGh5NGR3MWxMNjBYaGlQS0tLdUgtbWNydTBFdWd5cEhNZUpvdmF4aEFJN2hLby1ZTUoyUzhsSlc0YngwOXFBN2FfcW5JT2xaaw?hl=en-PK&gl=PK&ceid=PK%3Aen,2025-06-09 00:00:00.000000,2025-06-09,2025-06-09,471.97412109375,0.005038498867470098,0.0022055724302144333,Jim Cramer Calls Microsoft’s (MSFT) Latest Quarter a “Great One”. ,0.8580327033996582
MSFT,"Microsoft: Financial Strength Personified, Remain Strong Buy (NASDAQ:MSFT)",,https://news.google.com/read/CBMiqAFBVV95cUxPQlpzcTNiUzhsTFlCUV9ScUJvZ3F5T243dzVKZHVOZHI1RmpQdEVyZzVvMko2RjlhQ20yUUpmYlpRYzlZZkZ4bjBvNVk2TVdidDNORlJieXozWl9GZ3lITy0yTnVYVTE3cFhVUFJkRmRkNWhmcWEteVRFYzAxZWExQWt6TVhTU3RFbXNKa1pQZmFhajFySms3dzZsODhYQjVPVU55aTVtanA?hl=en-PK&gl=PK&ceid=PK%3Aen,2025-06-09 00:00:00.000000,2025-06-09,2025-06-09,471.97412109375,0.005038498867470098,0.0022055724302144333,"Microsoft: Financial Strength Personified, Remain Strong Buy (NASDAQ:MSFT). ",0.8369046449661255
AAPL,Where Will Apple Stock Be in 5 Years?,,https://news.google.com/read/CBMihgFBVV95cUxPT2ZBRWlMSTNtczZZOUQxdU45enMtNFVHdDAwRG1YRWpjdjBYY1V3c21odHRoV1NsSjQ1RVZwM0tXcTNTQmNjeGlJQ0hlMl9aT2E3djJVOVpjWWVzN0ZsdkVyeWZfRTJtZmp4RGd3OWNNQm9sWmtHRUd2Q3oxMUx5dGZoZWkwUQ?hl=en-PK&gl=PK&ceid=PK%3Aen,2025-06-06 00:00:00.000000,2025-06-06,2025-06-06,203.68882751464844,0.01639826694665114,0.008666110592879715,Where Will Apple Stock Be in 5 Years?. ,0.0
MSFT,"Microsoft reclaims top spot, Omada IPO, Vail trims outlook",,https://news.google.com/read/CBMihwFBVV95cUxOZk9LWWVuTFN3X0FBLXk0RG9tT0VDbXl4T2VwSVpOZ25ERTdmbVJOOFE0eTBuXzZ2VDBQbGprZmRSNnlLWVJwb01vRFlJZDUtdndiR0NFSE5kNGlvNk1zWjMxVC15ckdGbFJnVnFGd1p0LXlTOFhmeEdqaWdvRUczRzRqcjEtem8?hl=en-PK&gl=PK&ceid=PK%3Aen,2025-06-06 00:00:00.000000,2025-06-06,2025-06-06,469.6080017089844,0.005773218004487157,0.0022397258524931895,"Microsoft reclaims top spot, Omada IPO, Vail trims outlook. ",0.0
GOOGL,Why Alphabet (GOOGL) Stock Is Trading Up Today,,https://news.google.com/read/CBMihAFBVV95cUxNVE14eTJpVTMxLTdGTm5yT0N5VzJyVXRheUFwY3VlbFRQYmVGVFZoQldURzh2REVzY3ZmMGc2dU9lSHhKekc2Vm9mNVVfaFY3OFNRaHVHTWhPLXdrb0JOLUFGbEZGUWdlcTVwT3Bpb3ZaMDRzWEdSdG9haGVMN2E1QVRzMkg?hl=en-PK&gl=PK&ceid=PK%3Aen,2025-06-06 00:00:00.000000,2025-06-06,2025-06-06,173.46998596191406,0.0325187398698803,0.016916025253255296,Why Alphabet (GOOGL) Stock Is Trading Up Today. ,0.0
GOOGL,Try new data visualizations and graphs for finance queries in AI Mode.,,https://news.google.com/read/CBMicEFVX3lxTE9HTkI5Z1lmc0FmM0pKWTFIUFVyUUE3RXdqQzV4TElEVGxROVlUUUpZMnRjelZtYTJySEhKUDRLQ0swbURiZENWaVRpalZ0czIzQmZkVmNyMG1MTTZhWVp2QW0zdDlzcFU0ZHpwVnV2N2s?hl=en-PK&gl=PK&ceid=PK%3Aen,2025-06-05 00:00:00.000000,2025-06-05,2025-06-05,168.00662231445312,0.0009521811256865131,0.009781917733630612,Try new data visualizations and graphs for finance queries in AI Mode.. ,0.0
GOOGL,Google can now show all your stocks in a custom chart,,https://news.google.com/read/CBMiYkFVX3lxTE9tWTNYRndUbGZlQ18zQlJQcVQyclJEZlVCSV9FaXhRZURwUWFld1l6cEJ6RzQyR2RlVkhJUlVOMjRaTHFKbUwtUjZmaGdaLU5TeVBLbXdkdTRtLVE4eTZIUjNn?hl=en-PK&gl=PK&ceid=PK%3Aen,2025-06-05 00:00:00.000000,2025-06-05,2025-06-05,168.00662231445312,0.0009521811256865131,0.009781917733630612,Google can now show all your stocks in a custom chart. ,0.0
GOOGL,"As It Sits Between Two Benchmarks, Google Is Set For This Option Trade",,https://news.google.com/read/CBMilgFBVV95cUxNMGxnakN3ZzNVOHJXOWF1SWJmQUR3VllteUwtc1Zxb2JsY2dVLUlQVG9hOUwzT0pEVDAzZGhINE94LWNLTGxxRU5kY2hkb2ZDRXBfdWZYT0I3Vkp0MmpSMWtlYktLYnJoaWpWV3d1aXB0bWdtQ1Z2VU1WdHJsQzliT0tpYS1EVUl0M1F6Rlo3LXJmRU9xLUE?hl=en-PK&gl=PK&ceid=PK%3Aen,2025-06-05 00:00:00.000000,2025-06-05,2025-06-05,168.00662231445312,0.0009521811256865131,0.009781917733630612,"As It Sits Between Two Benchmarks, Google Is Set For This Option Trade. ",0.0
AAPL,Why Apple Stock Is No Longer a 'Buy' for Needham Analysts,,https://news.google.com/read/CBMimAFBVV95cUxOZFp6cXFTaUl0dDJHeGZvMWlyTHl1Y0owSEtoWUpMVEpJcUxONHcxX0d5WlpyOGNaNVNKOUlTeHRWNHVHVFFxc1Q3OG9mWEdqTXZWTnVsbWhfTUVGY3kwdWNlLTFnU0VQWnRZaWhLekFjTy1tTGhjQzhENENYekNEQkJYTHdJUC1UeUxlQmk5R25lRkdXMUV1NA?hl=en-PK&gl=PK&ceid=PK%3Aen,2025-06-04 00:00:00.000000,2025-06-04,2025-06-04,202.590087890625,-0.002213746602105271,0.009492536553890775,Why Apple Stock Is No Longer a 'Buy' for Needham Analysts. ,0.0
GOOGL,Google's Black Swan Event and a 25% Loss: ETFs to Consider,,https://news.google.com/read/CBMifkFVX3lxTE91azdCYVctc2JnZDBVczN6Qml3bFFucGFpRElvY0hUcTBxeGVDVFoyLVY1bEtSQXVnUEVMTks1bWNld3Y4LUZvS1dEU2ZRVG1MOVcxUlJsTjhraEprMFBiM1FaTnk3TVZSaUVtcGlmQjlyeXNGMFVXM09Zc3ZuUQ?hl=en-PK&gl=PK&ceid=PK%3Aen,2025-06-04 00:00:00.000000,2025-06-04,2025-06-04,167.8468017578125,0.011252845755370444,0.015108236940953456,Google's Black Swan Event and a 25% Loss: ETFs to Consider. ,0.0
GOOGL,Alphabet stock could fall as much as 25% in 'black swan event' if judge orders Google Chrome divestiture,,https://news.google.com/read/CBMi4AFBVV95cUxPdVBSMGxsQTFJNnRzMnJNUHZJd1lCRXE0YTZHMkxMbkxPRlYzS3FZRTdUNFdHeVNjX21YTWpUaDF6RUZCMEswMngxSDNxQ3BMYUNMVTZjZ3g3b3FucmlEVm8xY1dhMlVwd0VJclJvQkZpOFVJbFJ5X0JBZEpjM0dRMDJJeGhHZlhPY0k0OWRZcUZjX1I4V1VvSUV2S19XeF9selRzWmVXenFwXzM3VG85QnRfZklqRnhDSUxPeWZXTFE1cFFOeENOM2licEVlWDhKQi1zaDVnYzA2Uzd6QXAxVg?hl=en-PK&gl=PK&ceid=PK%3Aen,2025-06-03 00:00:00.000000,2025-06-03,2025-06-03,165.97906494140625,-0.01686093363108765,0.014920131558777196,Alphabet stock could fall as much as 25% in 'black swan event' if judge orders Google Chrome divestiture. ,-0.971365749835968
GOOGL,Alphabet (GOOGL) Stock Slides as Market Rises: Facts to Know Before You Trade,,https://news.google.com/read/CBMihwFBVV95cUxOcjQ1RGZpSU51bERPZERnWFliVVVYWmlzUm13YW1jNmRjaXZzQzlsZ0NjZXVONFpqNWVDN2Fsc0xXb2NlWk42dXM2SUNWaXh2RFBfN1AtcGJnZG00OHhaWWltOTZWd0JOZXZfcFp1b3dleUpKaFl4QThpcTgzU1FnWExKU2FYZWc?hl=en-PK&gl=PK&ceid=PK%3Aen,2025-06-03 00:00:00.000000,2025-06-03,2025-06-03,165.97906494140625,-0.01686093363108765,0.014920131558777196,Alphabet (GOOGL) Stock Slides as Market Rises: Facts to Know Before You Trade. ,0.0
GOOGL,Alphabet Inc. (GOOG) Stock Declines While Market Improves: Some Information for Investors,,https://news.google.com/read/CBMihAFBVV95cUxPZjF6R0YzVGhYampHZDBERHpWQ0VyaEFRT29GWFVRSEstblc2cmlxR3Y1NTUtUlFTQkJXclBqcVp5U3Fwckx6bWJOV0d0ZHg1Z0tNeF9tT0dyd0hZNE92Y251U3BESndNQ3djZ01VZFVESk5fZlRKQ19LeVQwaVpBWUw2LWU?hl=en-PK&gl=PK&ceid=PK%3Aen,2025-06-03 00:00:00.000000,2025-06-03,2025-06-03,165.97906494140625,-0.01686093363108765,0.014920131558777196,Alphabet Inc. (GOOG) Stock Declines While Market Improves: Some Information for Investors. ,0.0
MSFT,Should You Hold on to MSFT Stock in 2025 Beyond its 9% YTD Growth?,,https://news.google.com/read/CBMiqAFBVV95cUxObmN3S0hYV0xrUmFaYndMaUtIUmFfS2t2ZGw5MldKanRxdXd1SFhfQjdVVm1uc1ozZTBNVDJ5Q3V5aE9ZRmhxY0JoTWNscGtVeVVZbUl5SDJwWDFyRGJSUHcxNGVQci1UdWF0bXJEZFpNRFd6NlJIUE4xV2FERk4xUUxtYWZtSExoc2tMd21vTzJLNW13d1lKN01wbmVMd19oSjdScV9NUS0?hl=en-PK&gl=PK&ceid=PK%3Aen,2025-06-02 00:00:00.000000,2025-06-02,2025-06-02,461.2118225097656,0.003497336510424276,0.010802161853080791,Should You Hold on to MSFT Stock in 2025 Beyond its 9% YTD Growth?. ,0.0
GOOGL,Is Trending Stock Alphabet Inc. (GOOG) a Buy Now?,,https://news.google.com/read/CBMihAFBVV95cUxOeE1KWG5SWE01a0pyeWhxRXVpUEhmdUctbm8zREU5T205NkpCX2JfVTVxWC1VYmJzSVlacDJ6QlgtNkltbk9xaFNNd2p0VXIyZjNVa0lPak9jNWs1UmphS3Y3QW9EWEJYMFJ1bzJiRGRWRUhTZ2JkT0xvQmpCWEVST3VsNHU?hl=en-PK&gl=PK&ceid=PK%3Aen,2025-06-02 00:00:00.000000,2025-06-02,2025-06-02,168.82562255859375,-0.015779682933234063,0.014958244152527191,Is Trending Stock Alphabet Inc. (GOOG) a Buy Now?. ,0.0
GOOGL,Why Alphabet (GOOGL) is a Top Growth Stock for the Long-Term,,https://news.google.com/read/CBMigAFBVV95cUxNaTFzVS1LLWpuZG5pNXBQOVhOcTlpOG1mQm84S01rMXl1MUlpMDFvaWFFUnc2YlFJelRZWGNpOUpXWmFZVERGd2RZc2lKWGtEeTc1bUI2MkMtcFdwOWdNMlV6czdSOEJKdlloaTRDbVJRekRCREViNDNMTlFSa3NLbg?hl=en-PK&gl=PK&ceid=PK%3Aen,2025-06-02 00:00:00.000000,2025-06-02,2025-06-02,168.82562255859375,-0.015779682933234063,0.014958244152527191,Why Alphabet (GOOGL) is a Top Growth Stock for the Long-Term. ,0.7634580135345459
AAPL,"Apple Has ‘Significant,’ Long Term Opportunities, Despite Risks",,https://news.google.com/read/CBMidEFVX3lxTE5XTVotZDhRVUtXR05qMk5JVkczTS1Kc0tuSVBCeEpob3lKanJ5eVZYRFp1My1ydUdvZ2U5eTFkNzhuOGJNR05oWDVickxrMElBN19rajB3MHNNb0xEMmtsMS1zWXpNLTMzSGViWWJQYkttVVQ3?hl=en-PK&gl=PK&ceid=PK%3Aen,2025-06-02 00:00:00.000000,2025-06-02,2025-06-02,201.47134399414062,0.00423197959474253,0.01639288199806882,"Apple Has ‘Significant,’ Long Term Opportunities, Despite Risks. ",0.9333281517028809
AAPL,Apple: Double-Down When The Market Gets Silly,,https://news.google.com/read/CBMijgFBVV95cUxPeGJuNFhGUGRKVzZRRWp2M3FtTlFkNG8yT3NhWEhqMllOMXozdmM3ZkR2QW5Vc3N0UHA5QTNUN3dJdURxLWtvTDJ2dEFXMEF1Q3c3eFNMSVN6QjJONFdwd0hmV2pLM1lTOHJLNzBROUJmd1RTUFZxTDM5b3A2ek1UcC1iUnlOaXMzNnZjQ0VB?hl=en-PK&gl=PK&ceid=PK%3Aen,2025-05-30 00:00:00.000000,2025-05-30,2025-05-30,200.622314453125,0.004501160816033689,0.018307689115203692,Apple: Double-Down When The Market Gets Silly. ,0.0
MSFT,Why Is Microsoft (MSFT) Up 7.8% Since Last Earnings Report?,,https://news.google.com/read/CBMid0FVX3lxTE4xcDBiNEVDV1U5ZG53ZkJBQ3FPQW82dU11djlPY2VaODNpTTRoT2JaWG1veTNCN0puQUpLcTF2NDNKNTB2N3B0cktUXzFjdmFKVGNLd2c3eDdJbElrZjNObnAyRVlFVmx2WXJ2UzVZQTM4aDNpcWE4?hl=en-PK&gl=PK&ceid=PK%3Aen,2025-05-30 00:00:00.000000,2025-05-30,2025-05-30,459.60443115234375,0.0036626247995799055,0.012220240962245516,Why Is Microsoft (MSFT) Up 7.8% Since Last Earnings Report?. ,0.8629317879676819
