ticker,headline,summary,link,scraped_at,date,Date,Close,daily_return,volatility,text_for_sentiment,sentiment_score
MSFT,Microsoft Corporation (MSFT): Among the Best Stocks to Buy According to the Bill & Melinda Gates Foundation Trust,,https://news.google.com/read/CBMiiwFBVV95cUxOWm43UXc3WEkxTk8walduVTRzX1I3VzdkcUMteWZvZDhaMnR0blZoZ1QzeHVMSi05cHk3cFltLVpfUWh4SGJlTExKNHBRS08yRXNUeUQ3LThyck55X3g3MzZkN0pEMkdyajdnUXgtV3pRUE1wTkE1NmZxNEVqS3ZZcEFtYm0xcW9sMTZj?hl=en-PK&gl=PK&ceid=PK%3Aen,2025-04-30 00:00:00.000000,2025-04-30,2025-04-30,393.88818359375,0.0030961157495594804,0.012484941991856166,Microsoft Corporation (MSFT): Among the Best Stocks to Buy According to the Bill & Melinda Gates Foundation Trust. ,0.7318788766860962
GOOGL,Alphabet (GOOGL) Stock Gears Up for Monster Breakout,,https://news.google.com/read/CBMihwFBVV95cUxPbU5VQWcwQ3R1Zk5mSWlqUVBMYnhEN0RpYkRMQ3R3VWxXNXQxal9TR2xqQUdnb1NtNC1sMzBDN2J0SUF1c3hGTUg0Vjg4UFVaOWtXSDRkNllfSGNNcGxnM2k2UzdCeDlsaXJ3S3Vub0JqWjB0MkRfV05neC1wSEFRQXU2UVVnaTQ?hl=en-PK&gl=PK&ceid=PK%3Aen,2025-04-30 00:00:00.000000,2025-04-30,2025-04-30,158.6079864501953,-0.008491585154081771,0.016390497600153216,Alphabet (GOOGL) Stock Gears Up for Monster Breakout. ,0.0
MSFT,Microsoft boasts Q3 cloud growth and revenue beat,,https://news.google.com/read/CBMihgFBVV95cUxNSUxBVHYyS0ZsUEc4b3Y0YXU2QUxMNXdiQk1HZFFZV2JrQVdKTlllbjFHYkVyaXU2ZF84U1FzQzFjbmNzY2RkUjVad0tNSGtQT0o1VlItZllGa1o5UHBwM21ELXJmYXRfZlIwTUptQ1FNcTdNYUhabEtpZWFMWTB2ZDV2b0g2UQ?hl=en-PK&gl=PK&ceid=PK%3Aen,2025-04-30 00:00:00.000000,2025-04-30,2025-04-30,393.88818359375,0.0030961157495594804,0.012484941991856166,Microsoft boasts Q3 cloud growth and revenue beat. ,0.9538672566413879
MSFT,"Anthony Scaramucci Once Purchased $1,200 Worth Of Microsoft Stock For His Son In 1992 And Then Forgot About It — Three Decades Later, It Quietly Turned Into A Small Fortune That He Didn't Know He Owned",,https://news.google.com/read/CBMiiAFBVV95cUxPM2ttQmpseng2Ui02STk2SmlfY252RmwwMHg2TmxfWnVTbG9aZjlwbGYxQXRxc3UzV2lpX3ZEOXNwdkZ1TEpMcGM0Z1VBU1NSN2tjZ3lsWFlqc1JCZklmcUhTMTJfZ0UtQWNGeGc5dzBJLTlSTWVsMDE1d0t4eWVhZlZJRkZMbVFE?hl=en-PK&gl=PK&ceid=PK%3Aen,2025-04-30 00:00:00.000000,2025-04-30,2025-04-30,393.88818359375,0.0030961157495594804,0.012484941991856166,"Anthony Scaramucci Once Purchased $1,200 Worth Of Microsoft Stock For His Son In 1992 And Then Forgot About It — Three Decades Later, It Quietly Turned Into A Small Fortune That He Didn't Know He Owned. ",0.0
MSFT,"Microsoft shares jump 9% on earnings and revenue beat, uplifting forecast",,https://news.google.com/read/CBMigAFBVV95cUxQNGFzeDdWY0o4N0ZIekRWQ0xxWkVOd0pKWTQ2NVNseUI2QXN0RmNDWXBXVnFOUnhZakcxS0VzMjduN0F4OExBZFpKYWpwY3ZfaFY2NlRlcHVaY1BCdVkzeS1HUmJKVXZpby1ILXNZaHdPRy1UbFJiQnNyQUdET2dBOdIBhgFBVV95cUxQSHA2ZnpzbUJkWkZOTmhUWklodUQwd3M4TnhIM3BEZEg4UGU4RlJIaldEc2c5VUZ3d2c0RVh1aVVKQU16WDBoQVhRMUx0bGlLUHBkWDFRY2cweTNuY3pWWW4zSXFVRXpwemJIOGxJVE5TZF9ZelA4RTZad2ZjbTAyYV8tX3h5Zw?hl=en-PK&gl=PK&ceid=PK%3Aen,2025-04-30 00:00:00.000000,2025-04-30,2025-04-30,393.88818359375,0.0030961157495594804,0.012484941991856166,"Microsoft shares jump 9% on earnings and revenue beat, uplifting forecast. ",0.9402559399604797
MSFT,"Microsoft (NASDAQ:MSFT) Beats Q1 Sales Targets, Stock Soars",,https://news.google.com/read/CBMiggFBVV95cUxNbTBOa1ZyQ3RXS1pIVGhCM2RUcm1GRW5HNG1rbHg3NHZtejVTV3duZFBSRUxvR2JfVlBIemY0X3BUZFBESG9HVFRzdmtWYkpna1pJVElXbnVKMGw0QTVXVUtfNE9ldEVpZFlJWkQ2eVpHMnl1aU9hR1dnR0tFclRWSUdB?hl=en-PK&gl=PK&ceid=PK%3Aen,2025-04-30 00:00:00.000000,2025-04-30,2025-04-30,393.88818359375,0.0030961157495594804,0.012484941991856166,"Microsoft (NASDAQ:MSFT) Beats Q1 Sales Targets, Stock Soars. ",0.8147545456886292
MSFT,How To Earn $500 A Month From Microsoft Stock Ahead Of Q3 Earnings,,https://news.google.com/read/CBMiggFBVV95cUxOQkFaRE5XcE5FYXRRWlYwTHJFMlVaN1NmVnVLLTdOcnZWYWs2cXg1X0h6dnkza0F6OU5EaXBpTkFpeElCSy0yU250bnB6b0VyQW83b1ZfU1o5VXNXUFhmUF8wYWFWcUZzaWlqXzVTTWdUX1NraktfLUN2WFZ3Yi1QakdR?hl=en-PK&gl=PK&ceid=PK%3Aen,2025-04-30 00:00:00.000000,2025-04-30,2025-04-30,393.88818359375,0.0030961157495594804,0.012484941991856166,How To Earn $500 A Month From Microsoft Stock Ahead Of Q3 Earnings. ,0.0
MSFT,"If You Invested $10K In Microsoft Stock 10 Years Ago, How Much Would You Have Now?",,https://news.google.com/read/CBMigwFBVV95cUxNOFN3QmdRZkJDLWJNa0hJaVdSNWxqcFFLOE1DOVNSX1hhY2NBTFB2OFJpVWxNRTloOUhjZXdzUVlKSENkWkxLUDRmeW0wRjV3SzRaUGZiOTZxTzNRc3FuYkZNOUpTZ1NKOHRSQjdxZkowRDYxYVZ6dzRUTzkyVXJoQlg2VQ?hl=en-PK&gl=PK&ceid=PK%3Aen,2025-04-29 00:00:00.000000,2025-04-29,2025-04-29,392.67242431640625,0.007362691718169723,0.01878446323538776,"If You Invested $10K In Microsoft Stock 10 Years Ago, How Much Would You Have Now?. ",0.0
GOOGL,U.S Department of Justice Seeks to Cut Alphabet (GOOGL) Stock Down to Size,,https://news.google.com/read/CBMiggFBVV95cUxNRUVsSmtnSWpRV0RwcDh5OFJYM1hITllWNzR2dFdCRnBLb1hiNG1sbGZxM3Y5aXV4ZTcyTmh6dE5oYjBJOU5Kb1FRVzlabTljOHgxNlN2dDdNeU9hWVU1amNTU1RXazctRXl6c0pqOFlMc19UQ2dwbUwtdnFhdmU2elFB?hl=en-PK&gl=PK&ceid=PK%3Aen,2025-04-29 00:00:00.000000,2025-04-29,2025-04-29,159.9663543701172,-0.002801766573036657,0.01979214040046669,U.S Department of Justice Seeks to Cut Alphabet (GOOGL) Stock Down to Size. ,-0.9508989453315735
MSFT,Jim Cramer Says Microsoft (MSFT) Stock Has Been ‘Abysmal’,,https://news.google.com/read/CBMiggFBVV95cUxPSThfSWY3QVhsWTFsaXFyYS1uOXd0S2tEN1dzVU90LTI4cXBxdTBqTGhXbUFyUXZQS2NtY1BmZDZUbmVhcXJMek8wX0c2Wk5icGtvbWRzQVl0RFNFMkViUFc1dkdBRllaYVBqdW1hLXM5S0MzVC1iN2RmZE1tdEVmM3FB?hl=en-PK&gl=PK&ceid=PK%3Aen,2025-04-28 00:00:00.000000,2025-04-28,2025-04-28,389.80242919921875,-0.001760842828736786,0.0203296724890574,Jim Cramer Says Microsoft (MSFT) Stock Has Been ‘Abysmal’. ,-0.971512496471405
GOOGL,Here's How Waymo's Robotaxi Momentum Will Pay Off For Google Stock,,https://news.google.com/read/CBMikAFBVV95cUxNLTJKYVpSVXdiU3A3ZVdsYklvUVRMMUVIYkpNeUstck9LZXV2MlVTNy12eFNsNm5nSkJwV1Fyb0FrMHZkNzJkNHhyVTJ6cHJmQzhFcElaMWNzQ05YTnVSZHNZQVFoRGxyU1hlN0JlU1pSUWxmWnpFbkoxaHdiU0VBeFVUeDZCVmtqWGhDUGF4ZDQ?hl=en-PK&gl=PK&ceid=PK%3Aen,2025-04-28 00:00:00.000000,2025-04-28,2025-04-28,160.41580200195312,-0.008335426614863306,0.021278120864664435,Here's How Waymo's Robotaxi Momentum Will Pay Off For Google Stock. ,0.0
AAPL,"Going into earnings, is Apple stock a buy, a sell, or fairly valued?",,https://news.google.com/read/CBMinwFBVV95cUxOWXdwSjl1cERaVTlVTnQxTFpFTXBFTmNFampwV2hUbDRaUk9ZajQ3M1dxVmFFMWpZVXZ2ZXFKOFlRc3ZzbmFnRktXQ09ac1hmak4tQjBIQkZCWlhFSFFJNFltME5EN1pIUVhLX1dvcldWWlE1ZndFTlNoWkM5WXlqTkt5XzRJUWswX01meDhRWEpfUUhjRjNka0xscFhTdWc?hl=en-PK&gl=PK&ceid=PK%3Aen,2025-04-28 00:00:00.000000,2025-04-28,2025-04-28,209.62689208984375,0.004109375580146679,0.01726078403013462,"Going into earnings, is Apple stock a buy, a sell, or fairly valued?. ",0.0
AAPL,Apple (AAPL) Stock Earnings Preview: What To Consider Before The Report,,https://news.google.com/read/CBMimwFBVV95cUxQSzdwMThvaDFUTE5pR1pZdllRRUJLYnhDdllDbEdXWkNhcUVEcEtzOEppRk9TTGFiUDJON3FlbjB6ejB4SUx0QVpkV0VldVpvVFo1UUFMeUNuT1E4cl9YOXVRbjNlR3VzcmF4RkkxMzNZYXhDejkwSVdVREdfWVRtbk5kbzk1RHZTR19fRHpoWEotSno3eFBnY0tNQQ?hl=en-PK&gl=PK&ceid=PK%3Aen,2025-04-28 00:00:00.000000,2025-04-28,2025-04-28,209.62689208984375,0.004109375580146679,0.01726078403013462,Apple (AAPL) Stock Earnings Preview: What To Consider Before The Report. ,0.0
GOOGL,Is Alphabet Inc. (GOOGL) the Best Safe Stock to Buy According to Hedge Funds?,,https://news.google.com/read/CBMif0FVX3lxTFBvSWhUSFlEYnUybkdQNkFkLVY1QWl4aUpLbi1IX1JQRVFLUnVJckdwTXgzendVZUtoTWhRam1BN3dPd1NPQUJacjZtZ3pkZ3I4WVNNRlE5ZEtWMGNOUWwyZHI4U1pmSTI1a19VaDU4V3Y4Wjlzd0h3czlKT2tnYUk?hl=en-PK&gl=PK&ceid=PK%3Aen,2025-04-25 00:00:00.000000,2025-04-25,2025-04-25,161.76417541503906,0.016825801615046654,0.022879804912664573,Is Alphabet Inc. (GOOGL) the Best Safe Stock to Buy According to Hedge Funds?. ,0.0
GOOGL,"GOOGL Q1 Earnings Beat Estimates, Revenues Rise Y/Y, Stock Up",,https://news.google.com/read/CBMihAFBVV95cUxOOVhHM1EwU1JrS1hCLXJRbTltTVBnWUd6dGRXb2NaeXlKTDZuTU9GV3JDeklIYlZ0bWJwTjBOSmVjbEFMMWdHdGhzck94SHViMXNaa2VtN1ZUdW1VajFrLXRVSVUwRUF3UzQzRnpjY3JKbVQ1elJYX1F6Z1BGcVVuX3JIOWE?hl=en-PK&gl=PK&ceid=PK%3Aen,2025-04-25 00:00:00.000000,2025-04-25,2025-04-25,161.76417541503906,0.016825801615046654,0.022879804912664573,"GOOGL Q1 Earnings Beat Estimates, Revenues Rise Y/Y, Stock Up. ",0.9517245888710022
GOOGL,Is Alphabet Inc. (GOOG) the Best Stock to Invest in for Long Term?,,https://news.google.com/read/CBMif0FVX3lxTE5MRmFkWFFSc3E0aWNYSHJ2X0k2ZHZvRGg3ZW1zMmtFTmpxOHlzMy16Vnk1VUhaNDVTUHJqcFRPLU9iTjNzM1hSWTZhc0QyRWhjdUFHMXRqbHk0Y3Q5bjN0X2YtalJzNFVXQ2xzeFFTbUd2ZUpmVmp0MVM5emRka3M?hl=en-PK&gl=PK&ceid=PK%3Aen,2025-04-25 00:00:00.000000,2025-04-25,2025-04-25,161.76417541503906,0.016825801615046654,0.022879804912664573,Is Alphabet Inc. (GOOG) the Best Stock to Invest in for Long Term?. ,0.0
GOOGL,"Stock market today: Tesla surges 9%, S&P 500 gains for 4th-straight day in longest win streak since January",,https://news.google.com/read/CBMi6gFBVV95cUxPd2dpNjEtRjR6YnhvcUV5V2ZtaVQ1a0Nhck1md0owbTE1UWZSVVczZU1JYnhCY1pRTk9mczVDUFN6cDEwdXJxd0lHanRhUUM1UkFjSUtpVnRDRVJNVEtWTzRnQy1zMURpTmNKbjhPVGh3MHZmNWJLMjFCMFVlcjctMngwWWstVG96cUwzREFNY1h3ZFpRWjdheDdIZXJFVnJEXzZRN2hGRUZBQmxudzFHTHY4VlpQci1mRGtsQXBmdVM1a2RfTXdrcC1XYmFBbXF4Qlo2RHIzaERyakdoOEx6R19BbUc2M0YycXc?hl=en-PK&gl=PK&ceid=PK%3Aen,2025-04-25 00:00:00.000000,2025-04-25,2025-04-25,161.76417541503906,0.016825801615046654,0.022879804912664573,"Stock market today: Tesla surges 9%, S&P 500 gains for 4th-straight day in longest win streak since January. ",0.9012902975082397
GOOGL,Google stock in focus after better-than-expected results,,https://news.google.com/read/CBMi5wFBVV95cUxOTi1fT3BMR243ZVlobVI4NlhoQVA2UHpjU3g1a2hoMmNtZkpqazVTUzlVVjBjd2pFLUZITHFnY2ZGOWxNWEZuek02TkFDUDhjdTVMcE1wMC1ITXZwLXhaMmVXaWZLT2ZKd0Z2RWZwR3g5cXM3MVNNTTZVa2dReGFjaFRXMVk4SWZFbE55ZmlsZW9OV3doa0cxZUtrVklHODJPbE1rRlEtLTZTR0ZOZ1pDU2Jnck9xdHdtbEF6UjVjS01UMkw3LXljOVVJZzVUT09nM0VUODJwNWpnQ0ZTcUUyQ0lCaHpiX3c?hl=en-PK&gl=PK&ceid=PK%3Aen,2025-04-25 00:00:00.000000,2025-04-25,2025-04-25,161.76417541503906,0.016825801615046654,0.022879804912664573,Google stock in focus after better-than-expected results. ,0.42700400948524475
GOOGL,"Stock market today: Dow jumps 500 points, Nasdaq surges as Wall Street rallies for 3rd day on easing trade tensions",,https://news.google.com/read/CBMi9wFBVV95cUxPaVRKMFpLd1I3TVY4eTBwVF9Gbk5NeWEzTm9DQmZMQ1gwSnBhbDFVQnRvLWluclhrOVMxQ1d3Uy1qX0hJVDA3bjcyaUZyMWJ1cHVCUHVMczN1Qm1jNUVjN19hTXlwRHlIc1BoTjJ2bjlNaTVCNlRicFlMdDVxTDVyekNsTGdBNWNuY1BTbXNRaWg3NmFvc2dtQkM2RDREeXJNQ0RueWQ4YXJWQVltd2tIbUFVZHZIOFFwa2JIY0lBTmU5ZUlwQmNZLWFvUUR5Q2V6RTc0MDZoT1JxaFdKY3BZQ3NYWlR5MnE2bDZJR3JxdEwwT1dsS2FB?hl=en-PK&gl=PK&ceid=PK%3Aen,2025-04-25 00:00:00.000000,2025-04-25,2025-04-25,161.76417541503906,0.016825801615046654,0.022879804912664573,"Stock market today: Dow jumps 500 points, Nasdaq surges as Wall Street rallies for 3rd day on easing trade tensions. ",0.8775181174278259
GOOGL,"Google stock rises after it beats on earnings, raises dividend, and authorizes $70 billion in buybacks",,https://news.google.com/read/CBMi3gFBVV95cUxOQUNMckdOZlBVdldVSDEzSkNHX19LemlyVnhEUGRPQU1ESV9za2VjbUY2cEtHSGo2eWZRU1E0akE3SnVlWktDLXZBRjRMM3RHeFJQa3JQTWhvZzFDX2N3S292ZWR3THJCRFpKYUlHOU5SaXRxTGhEVmE1Zk5QUGZneWp4RXZtTzJYb2kxdGM2bng0Y0VCTkgwR1lobkdFT19xakxEdzd2VXBGa1lSSWhJY2VBOUtKRDJLVThaSjQ5U1JlbG5Va0tMcDdjdk9zb012T09neTc3QUJSeU5SbXc?hl=en-PK&gl=PK&ceid=PK%3Aen,2025-04-25 00:00:00.000000,2025-04-25,2025-04-25,161.76417541503906,0.016825801615046654,0.022879804912664573,"Google stock rises after it beats on earnings, raises dividend, and authorizes $70 billion in buybacks. ",0.8690734505653381
MSFT,Goldman Sachs Is Upbeat on Microsoft (MSFT)’s 2026 Outlook,,https://news.google.com/read/CBMiiAFBVV95cUxNMmpIaWIxbWZGR1owMjdjdjlYbHZYT05CbHpPRzZkWTNmUkd3bjdmN1AxQ3lMZTBfVFVGbG43dkxzaGhRU0c3X3MwRERrZzhKRUlQTzA4TGhRTGlOc3hoNzFlTDVFbG1PcW0yYkwySl9qcG1WSlFvenNYN0hfMWNwdXFFZGJ5UFVu?hl=en-PK&gl=PK&ceid=PK%3Aen,2025-04-25 00:00:00.000000,2025-04-25,2025-04-25,390.4900207519531,0.0117480834781436,0.026355999697119763,Goldman Sachs Is Upbeat on Microsoft (MSFT)’s 2026 Outlook. ,0.7041948437690735
MSFT,Is Microsoft Corporation (MSFT) the Best Stock to Invest in for Long Term?,,https://news.google.com/read/CBMiiwFBVV95cUxPZ0tMVmowcUY0MU5YZlQwQjd0OGZNRHhFaFRHampBTGxhajJWdFgtQUpONDZYWE9mNC03RmVHQ1RjYUhVN0VJT2RQbnd5TjRrQzNPMjRMWmJTdVZNWGtCSU1jNUdRSktfMFRYMk0wZV94NElJbERDVHJhYWUtVEtaOVVzXzBqQWx6ODZF?hl=en-PK&gl=PK&ceid=PK%3Aen,2025-04-25 00:00:00.000000,2025-04-25,2025-04-25,390.4900207519531,0.0117480834781436,0.026355999697119763,Is Microsoft Corporation (MSFT) the Best Stock to Invest in for Long Term?. ,0.0
AAPL,How Will Apple Stock React To Its Upcoming Earnings?,,https://news.google.com/read/CBMihwFBVV95cUxOalMzYUhodWRFU1cyZTQ0bzBTZ1RNLTZyQUZhMVVESHdGVEtqYUYtdy1oa096em9FaFRvZzItVGh6NzRXU1ZjLWJiaUFMbzgzWnNGamk0bVZ2QmJBUTlHaGVuNXZnQWVtSzdxSUlHX3dmajF4Z1RaNUF0aGRXaGhCZnctUmh5ckE?hl=en-PK&gl=PK&ceid=PK%3Aen,2025-04-25 00:00:00.000000,2025-04-25,2025-04-25,208.76898193359375,0.004367221263343435,0.02583255112713557,How Will Apple Stock React To Its Upcoming Earnings?. ,0.0
AAPL,"Going Into Earnings, Is Apple Stock a Buy, a Sell, or Fairly Valued?",,https://news.google.com/read/CBMingFBVV95cUxQR0tXeW9Wa1d1OHJ1YVp5UGhSMV92dTUwQ0lGX1pabjRHZWNCVC10Q1NMakkzVS02eXhjempZZWFQS1dwMnJHUnlFcFFUZHU5MHh1dFpkVFEtWXRFQWcxX1FJamNrdkdkS19Gd1ZzWGg4WERsZW9xUnhmRXlSRl9Hd19yXzJCa2JSMXBOZ0lvck9vLVgxTjdnVWhQZV9WZw?hl=en-PK&gl=PK&ceid=PK%3Aen,2025-04-25 00:00:00.000000,2025-04-25,2025-04-25,208.76898193359375,0.004367221263343435,0.02583255112713557,"Going Into Earnings, Is Apple Stock a Buy, a Sell, or Fairly Valued?. ",0.0
MSFT,"Should You Buy, Sell or Hold Microsoft Stock Before Q3 Earnings?",,https://news.google.com/read/CBMigAFBVV95cUxOajNIaTVQNUdOTGxFYTAyZUtDYlRRc2RIeG02dXp5Nzg2M3BJV25Ja05kZkRZQUlPSlNHZkgzcDQ4TDh1VW9nYXZuZXZMTUEzQXBXR2tVUHlaSkRxTGE2MnpyZjNXTDRvLVk4UlBDaV94bzBKdTRBSlNMcFlqeU0yMg?hl=en-PK&gl=PK&ceid=PK%3Aen,2025-04-25 00:00:00.000000,2025-04-25,2025-04-25,390.4900207519531,0.0117480834781436,0.026355999697119763,"Should You Buy, Sell or Hold Microsoft Stock Before Q3 Earnings?. ",0.0
GOOGL,Google Earnings: Stock Soars As Q1 Results Shatter Expectations,,https://news.google.com/read/CBMiswFBVV95cUxNTVZVRXRDZWpCOTNsMkNDdXJDcHZtVVBULWNackNrZ0xtdFVTM0FtSEJkTmo1Y2YxWF9rVGw3MTlSMXljTkNMTzlheFg5QXdYM2U1TGd0ODhvT0N3Q1JCVFVZUFMtOHBiOVZRY2NoSVNCZzNBTF9QUzVPUE9pSjFlS0lYLThaZ2FVOE5xZ1BLNXFZcDJFNmhrZXBzSThJQWRKaUlybWtVamx6QjFoazRwUWJDbw?hl=en-PK&gl=PK&ceid=PK%3Aen,2025-04-24 00:00:00.000000,2025-04-24,2025-04-24,159.08740234375,0.02529760909645562,0.023646425315534594,Google Earnings: Stock Soars As Q1 Results Shatter Expectations. ,-0.7996516227722168
GOOGL,"Alphabet stock rises on Q1 revenue, earnings beat",,https://news.google.com/read/CBMihAFBVV95cUxPLXFOajNGa1pxMmF1b0l3d3hYdm85ajE4UktrajdmbGpkenBxRVVzRFVWNVR5cU1KbUhDbXFOWGZkSXBxanBsOXA0V0xlVDM1QzBiZnQzODZpYWJmNTZMSDRIcFFWSG14LXdWaWR2VFZQcnl3d3JST1BfN09TTzJMcmNXbFg?hl=en-PK&gl=PK&ceid=PK%3Aen,2025-04-24 00:00:00.000000,2025-04-24,2025-04-24,159.08740234375,0.02529760909645562,0.023646425315534594,"Alphabet stock rises on Q1 revenue, earnings beat. ",0.9256532788276672
GOOGL,Takeaways from Alphabet's Q1: Cost cutting & Google Search growth,,https://news.google.com/read/CBMiigFBVV95cUxNeUxDWDIxVmxtQjhzR2RHbG8wQ1dyRndOOHoxcDNtWjg2YUZ2T1JKdXJ0RFBIZVNZZlI5UV9wNFdYM1FEVS1MdU05dUJDODk0UGdMRkNjUXdQVmRCTHYyaTFfYS04WWVjOElVQjh6cEwtY1phQTFTY3lCSUpJM2FEeER2MzIzU0ZvQ2c?hl=en-PK&gl=PK&ceid=PK%3Aen,2025-04-24 00:00:00.000000,2025-04-24,2025-04-24,159.08740234375,0.02529760909645562,0.023646425315534594,Takeaways from Alphabet's Q1: Cost cutting & Google Search growth. ,0.0
GOOGL,Google earnings arrive with the company facing both AI and legal threats | Company Business News,,https://news.google.com/read/CBMigwJBVV95cUxQaTczOU0xRUhYYWYxclh3OGtHLTF2NlVVS3o2NkszbWlJWHg0cHRwTUlEb1VSSUNMMFRkTVUzWDJOWC1PQzNXM1NHWksyTWRrRUpBWjhmSVB0TlBmTUJsUDc5SkZGVlJ5eXlBcVc2dnhlQVJBbWQ1a0JMVFVOWW1jczhCLXo1OURadEtOTjQ4aURWYjFBN2VuUTVKRDQxTUdFc3NtWUFodmprRTRwZFNPTzNoZjNpVkRMMmRna2lvTzYzVVBscW54MjAtME1hWkRtSm1sS1d6ZU9QZlZjODdzUXpOUkVtZy14TzdTV0pTVjJ4bEZyM2xpUUpaMU1EQnZ2bGVj0gGIAkFVX3lxTE1TMXNtQVVUZGotOHplZDJpQWlhTWxkYUdFZE5CS1pMUVI1T19UcFhRUkZHY3pPcGpPUVU0Q0NMcl9idHNjemFhclgzRHhaZ2NEOTJwejN2V243dEM0ZzYwa1cxVmpDQU1SQmx6NW5Ic1dabzJRa3huU1MtMjJMVUtGMkxQQjRRcWdfdGVTMkJiN0xTaVlpc2d3aHljVzV1ZGtaVm5xWHBzZXNKT2hRV3FISlBIMEQwcE5lTjAwYlVKcWhTcFpIdlVEVHBoR1FQM3JhdUZWX2F1SjluZDF6MWFsZHVLRFZjY19lRUtuXy11OGZFSElZU1U2R1hSTWxFd0tzUUI2cjNKTQ?hl=en-PK&gl=PK&ceid=PK%3Aen,2025-04-24 00:00:00.000000,2025-04-24,2025-04-24,159.08740234375,0.02529760909645562,0.023646425315534594,Google earnings arrive with the company facing both AI and legal threats | Company Business News. ,-0.9440734386444092
GOOGL,Alphabet’s (NASDAQ:GOOGL) Q1: Beats On Revenue,,https://news.google.com/read/CBMiggFBVV95cUxNLWFhM0ZDRDZXemg4ZlJCN1g4TmdaU0tmd3AwUE1xNGkwMkhRUnZVNmxPNk45NmRzdWhXcUhQdEZLYlN3a2FLM0RLcTA5eGpXbjdyQVZRLXpDczNxanRTOVA2QWNaTUNNM1RlYmlWQW41eThxeW9FRmg4UkRQSWg2MXV3?hl=en-PK&gl=PK&ceid=PK%3Aen,2025-04-24 00:00:00.000000,2025-04-24,2025-04-24,159.08740234375,0.02529760909645562,0.023646425315534594,Alphabet’s (NASDAQ:GOOGL) Q1: Beats On Revenue. ,0.5775960087776184
GOOGL,Alphabet Q1 2025 earnings call: CEO Sundar Pichai's remarks,,https://news.google.com/read/CBMifEFVX3lxTE1LNXFZVDRqdVhuZUNDRW0td3ZXY1Ytb3hTRG1kV1JyTGstMmZMeFk1eldZX3EzMTY3REdOMDVEVUpUTU04anBFYjlKSnUzQlM0OWdtQURXbTFNVFgybFhPalJrS0p5bFRFRXhBbE1GVGNyVVJ5S0hfVmxPRWs?hl=en-PK&gl=PK&ceid=PK%3Aen,2025-04-24 00:00:00.000000,2025-04-24,2025-04-24,159.08740234375,0.02529760909645562,0.023646425315534594,Alphabet Q1 2025 earnings call: CEO Sundar Pichai's remarks. ,0.0
GOOGL,Alphabet shares rise on stronger-than-expected revenue growth,,https://news.google.com/read/CBMigAFBVV95cUxQdml1d2JEOG9NU3NhaG1CLW5OWFpnUHFxeUotaHhvNlZ2NEV0Z0oyNzJWX2xVaWN2UnlvUkMwaGY3ZFl3M0F6MWFVRHphWHVQSHV6SWNsU2s1U3dkblo1WjJFbHlwY2FzenNSUkNnbEltc3VKM25kMERZcUY2X1ExddIBhgFBVV95cUxOM0V4TjBlR0JtQUVfRHZnQmQzb2hkbEE0N3o4VldrX3hYSzZFeXAzNnJWb1BoR2M0NllXOFhmcExfTjh4RkF4ZU15S0pkeEV5Vmp6TUw0N0x0TFlyXzcyTUZxSWN3WHBZTmlfckc3S0NKWlQ5STVTajBiSnVIeG1FQzRKOEhFQQ?hl=en-PK&gl=PK&ceid=PK%3Aen,2025-04-24 00:00:00.000000,2025-04-24,2025-04-24,159.08740234375,0.02529760909645562,0.023646425315534594,Alphabet shares rise on stronger-than-expected revenue growth. ,0.950032114982605
MSFT,Microsoft (MSFT) Beats Stock Market Upswing: What Investors Need to Know,,https://news.google.com/read/CBMihgFBVV95cUxOano5WGhNdHRsdkZxMG9USkU1TXdoRS00WU5RWlZ5ZF9uQ2MxVkpITjNEODIydzg4cmVzZTdDd3BMcUxMUHM4UUFMZ1RsbkZDcDJXaC1KN0picmJaUFpOM1hlOG5nbkNRZUR3MFNMWU04Zkw5Rml1VG5mVDNjbXBSNEJsdmFxdw?hl=en-PK&gl=PK&ceid=PK%3Aen,2025-04-23 00:00:00.000000,2025-04-23,2025-04-23,373.09063720703125,0.020636836410287573,0.021365156203815853,Microsoft (MSFT) Beats Stock Market Upswing: What Investors Need to Know. ,0.0
GOOGL,Alphabet to Report Q1 Earnings: What's in Store for the Stock?,,https://news.google.com/read/CBMihgFBVV95cUxOdVJhMExmUjhkUnF6bHl4enpRck42dUZmYm05ZHFmRm9DZjJHWE1hZmZvT09sUFRwSnlpb0tWR2RZcUhtRGU0aDkzLU02T2pCaHBqY1R6X3VtMkJIb2ZUeUlqOVRUYlYxa0QtTERESGhDR3V3UWMzYkFPMWRrVnIwRUVGZzNOZw?hl=en-PK&gl=PK&ceid=PK%3Aen,2025-04-23 00:00:00.000000,2025-04-23,2025-04-23,155.16217041015625,0.025615712371535926,0.021804893572180413,Alphabet to Report Q1 Earnings: What's in Store for the Stock?. ,0.0
GOOGL,Is Alphabet Inc. (GOOG) the Best Stock to Buy According to Marjorie Taylor Greene?,,https://news.google.com/read/CBMif0FVX3lxTE1SY1VGSlpxaC1GYVFVWW9aRW05anJaOXVrTmxkSU9IZ3RiOTNCbWdSZ1VGNFloVFBvZUlFZlhBeU9IWGx2YmlUTlBDNndYMzJIdmlaQ196akpHaEgzcmpOUUhTSm54bkdLRVBOdS1GTHZab0hydlFXR2ozbm9BSzA?hl=en-PK&gl=PK&ceid=PK%3Aen,2025-04-23 00:00:00.000000,2025-04-23,2025-04-23,155.16217041015625,0.025615712371535926,0.021804893572180413,Is Alphabet Inc. (GOOG) the Best Stock to Buy According to Marjorie Taylor Greene?. ,0.0
GOOGL,Is Alphabet Inc. (GOOGL) the Best Stock to Buy and Hold for 20 Years?,,https://news.google.com/read/CBMigAFBVV95cUxNZUcybGR4bXI1ZzlzVW1WSzlGWkpWeUlLbUVYazkyenBqYXNRNTd4RlYtRDFRZ3FpUFJ5Z1FIa25OcFhxU2pwamhwaFBOX0NwSUFFZVQ0cTVLYmg0QlJCZWIwZVlELV90NW1wVWx5ZXhTUG9rLXJDUENIT1I3Vk9ORQ?hl=en-PK&gl=PK&ceid=PK%3Aen,2025-04-23 00:00:00.000000,2025-04-23,2025-04-23,155.16217041015625,0.025615712371535926,0.021804893572180413,Is Alphabet Inc. (GOOGL) the Best Stock to Buy and Hold for 20 Years?. ,0.0
AAPL,Apple Stock Is Down 23% From Its All-Time High. Here's Why I'm Still Not Buying Shares.,,https://news.google.com/read/CBMimAFBVV95cUxQNEUxVTRLaGxsbzRBQVRJOC10ZkJHX3NzbXhhYVFJdWhLWHJCRkFvSUo3LTFxaEJrMk5GamJxOTdVUERHbzBFZ2RaU0sxbEhQcjBKNUdjTl90SnYtZWR2QzNsTFc3eWpxVVREbHY2eWZBR0ZTMGh6Qi1FLUVfdEU1WGZvVXprREpPX3JqR29ERWY2amxtcGJHSA?hl=en-PK&gl=PK&ceid=PK%3Aen,2025-04-23 00:00:00.000000,2025-04-23,2025-04-23,204.1004180908203,0.02433161145205487,0.026336814473868604,Apple Stock Is Down 23% From Its All-Time High. Here's Why I'm Still Not Buying Shares.. ,-0.9696927070617676
MSFT,Is Microsoft Corporation (MSFT) the Best Nancy Pelosi Stock To Invest In Now?,,https://news.google.com/read/CBMiiwFBVV95cUxNZzNkc2trQ2IxZUZQeEZBbUtkU2pMOG5veDljemdKSTF3RHN2QUdfM0xxUUtiWTh0eElLVmxjQ2lyck5RR1AzR3lDY2ZQMWMxX1A2LThRc0hEcTJEUGV3a3YtVlRrUWRVR3Y1UDFiYWhfNGpiVE1LSmlCS3BfQ0tnQWE2SjdyUV9xSTJz?hl=en-PK&gl=PK&ceid=PK%3Aen,2025-04-23 00:00:00.000000,2025-04-23,2025-04-23,373.09063720703125,0.020636836410287573,0.021365156203815853,Is Microsoft Corporation (MSFT) the Best Nancy Pelosi Stock To Invest In Now?. ,0.0
MSFT,Microsoft Corporation (MSFT): Among Top Stocks in Bill Gates’ Portfolio with Huge Upside Potential,,https://news.google.com/read/CBMiigFBVV95cUxPYTdWU0tTRlBWemNUT054dUktS3RURmNabG50UjdMRFNUZnNFVW54OGRIVkpwVW9NeEhyTWs4aXJaV0pxOGZVdTZqZmRMeFFzWnJPQWo4cENYck90T2VHVEl1TGlOVHRyVmtOZmNtc3BjejF5RXJieW1ONnNiaExxdlhnS3BLbm5iNmc?hl=en-PK&gl=PK&ceid=PK%3Aen,2025-04-23 00:00:00.000000,2025-04-23,2025-04-23,373.09063720703125,0.020636836410287573,0.021365156203815853,Microsoft Corporation (MSFT): Among Top Stocks in Bill Gates’ Portfolio with Huge Upside Potential. ,0.7740789651870728
MSFT,Is Microsoft Corporation (MSFT) the Best Stock to Buy and Hold for 20 Years?,,https://news.google.com/read/CBMiiwFBVV95cUxNTnNqZVF2d1IxNUpxUlNQd3pueVM4VVhHM0lvRUQ3WEJGOU9MaUJreURjRXl4ZERMZy1LX1FCVXhlTEZLbWlOal93X0RXWTByWmI3THhNMmFuSUZ1QS1FTXFXSUFhSVpudEc5QzhJUFB0M2g3ZVBiN1BPYXpLVndrX1JwLU9CNkp3Uldn?hl=en-PK&gl=PK&ceid=PK%3Aen,2025-04-23 00:00:00.000000,2025-04-23,2025-04-23,373.09063720703125,0.020636836410287573,0.021365156203815853,Is Microsoft Corporation (MSFT) the Best Stock to Buy and Hold for 20 Years?. ,0.0
MSFT,Microsoft (MSFT) Earnings Expected to Grow: Should You Buy?,,https://news.google.com/read/CBMiiwFBVV95cUxPU21kaUlVQXlCZDYyT19lY3NmMnNULWtHNmJkcVBabTNNUkFwOE5Eb2kxMWl1elU5bkVNbHlxbWtZbXJFMmNmejkzb1hBa0lKTG94Z1FoV2xhUjA0dEtBTHYzaUhFbnR2TU5MT0JRa2MyM2xTQmItNTBzSmVoT1pJNW1GREphRUxvb1gw?hl=en-PK&gl=PK&ceid=PK%3Aen,2025-04-23 00:00:00.000000,2025-04-23,2025-04-23,373.09063720703125,0.020636836410287573,0.021365156203815853,Microsoft (MSFT) Earnings Expected to Grow: Should You Buy?. ,0.0
MSFT,Wall Street Analysts See Microsoft (MSFT) as a Buy: Should You Invest?,,https://news.google.com/read/CBMihwFBVV95cUxNLXliNUpuaVdsbktieGlQSkFiX0I4MlFRLXhuaUJhNUNlTjNtbnh1NWlsdF9LazlPUWk5LWhPZHBfNzZjRE1WT3YyVzJqWFhjNHpnYnNsMmhIU2hzUlVHSDF0ejJTQk1BNDdFSXhwbjlJQTBNejkwWUcwVEc4Z2M5WTAzU1VNXzg?hl=en-PK&gl=PK&ceid=PK%3Aen,2025-04-22 00:00:00.000000,2025-04-22,2025-04-22,365.5469055175781,0.021441395531364815,0.020970517264562522,Wall Street Analysts See Microsoft (MSFT) as a Buy: Should You Invest?. ,0.0
GOOGL,"Should You Buy, Sell or Hold Alphabet Stock Before Q1 Earnings?",,https://news.google.com/read/CBMif0FVX3lxTFBFYXNEUXF4aHBBYmlNUllEdkYzcUkxSVRUOVIwZjRhYTQzaFJ6Wkt6Z0xTNDQtVEUtMWxmQ2lfdjRYbWhCNlhmQ05aUkpXRGtqNjdmakNvaUFBMkNCTTBjVGthVk5kWmpuTUtnV09HZlpWZTRwaTN2MkdyZFBKa0E?hl=en-PK&gl=PK&ceid=PK%3Aen,2025-04-22 00:00:00.000000,2025-04-22,2025-04-22,151.28684997558594,0.025733087702574764,0.02236909613054347,"Should You Buy, Sell or Hold Alphabet Stock Before Q1 Earnings?. ",0.0
GOOGL,Is Alphabet Inc. (GOOGL) the Cheap Blue Chip Stock to Buy According to Hedge Funds?,,https://news.google.com/read/CBMigAFBVV95cUxPOHZwNW1MNzVrck5sb3pLU0xCN0hZMzV3bTlzRGc5aE5ob19ucy1Yd19EcUlsVWhVazVJTkFWVlBRbUY4M2hFaWQ5RWhpQXlmVFNlRkJkVTNiNGZfTkJfXzFMOVJTWlFsN2dPcGhUZjh4LU96YjRSRlpQcWpGd010eg?hl=en-PK&gl=PK&ceid=PK%3Aen,2025-04-22 00:00:00.000000,2025-04-22,2025-04-22,151.28684997558594,0.025733087702574764,0.02236909613054347,Is Alphabet Inc. (GOOGL) the Cheap Blue Chip Stock to Buy According to Hedge Funds?. ,0.0
GOOGL,Buy the Dip in Alphabet (GOOGL) Stock as Q1 Earnings Approach?,,https://news.google.com/read/CBMif0FVX3lxTE5WZHBkT0R5TVFrVDVOT1M0WG03SlBKTVFiY0pFUU9SY0NQeVY2SWZVOGR6YkRQYk5KZDNrUWJqMGtZbnhGWVRDVjNXX0VkanRLdXVxRlNTdGs2RTNBNktaeWZrRnNDT0tSSWRxbkVub1NIQVRrNFNIOGVsdE0zZ2s?hl=en-PK&gl=PK&ceid=PK%3Aen,2025-04-22 00:00:00.000000,2025-04-22,2025-04-22,151.28684997558594,0.025733087702574764,0.02236909613054347,Buy the Dip in Alphabet (GOOGL) Stock as Q1 Earnings Approach?. ,0.0
AAPL,"Sell Apple stock before it sinks another 30%, analyst says",,https://news.google.com/read/CBMiggFBVV95cUxPUXl6VmFjMDM3WjZQSEFaRDVnYjF3NEMtTFJVY21aTlphX1VxRlhtS01zelIzc2c0bjZDakRoaFlmTmhsVmF4RGY3QldEMEJWVEptRmFRaUFpUjFKRklPeE1VMzZ0bENfU20zRjNPMm9lTG5KY0NpdnlhVW1lRnUxX0dR?hl=en-PK&gl=PK&ceid=PK%3Aen,2025-04-22 00:00:00.000000,2025-04-22,2025-04-22,199.25228881835938,0.03406502870124406,0.028927971824818714,"Sell Apple stock before it sinks another 30%, analyst says. ",-0.7407553195953369
